question,cpu,gpu,ram,display,refresh rate,brand,price
"Which laptops designed exclusively by asus, do you have that feature ryzen 9 6th , nvidia rtx 4050 accompanied by ram 8gb alongside display panel 3k with 480hz designed for high-performance data visualization circa unknown dollars.",ryzen 9 6th,nvidia rtx 4050,ram 8gb,display panel 3k,480hz,asus,circa unknown dollars
"intel core i5 gen 14 alongside nvidia geforce rtx 4060 as well ram 128gb not to mention 1920 x 1080 and 90hz laptop developed in-house by dell, efficient for designed for high-performance scientific computing performance? on the order of unknown dollars.",intel core i5 gen 14,nvidia geforce rtx 4060,ram 128gb,1920 x 1080,90hz,dell,on the order of unknown dollars
"Assistance in finding laptops . It is designed by xpg, equipped with amd ryzen 7 8th together with rtx 4050 together alongside ram 24gb ; resolution qhd+ in addition to 480hz designed for high-speed data modeling The expenditure limit is $1909..",amd ryzen 7 8th,rtx 4050,ram 24gb,resolution qhd+,480hz,xpg,The expenditure limit is $1909.
"ryzen 5 pro plus nvidia geforce rtx 4080 coupled with ram 12gb with display quad hd as well 480hz laptop . It is offered by razer, ideal for ideal for running complex data mining algorithms command? more than 1314 USD.",ryzen 5 pro,nvidia geforce rtx 4080,ram 12gb,display quad hd,480hz,razer,more than 1314 USD
"amd ryzen 9 gen 7 plus nvidia geforce gtx 1650 joined by 16gb alongside display resolution 2560 x 1440 besides 240hz laptop curated by lenovo, efficient for use for data analysis tasks achievement? exceeding unknown USD.",amd ryzen 9 gen 7,nvidia geforce gtx 1650,16gb,display resolution 2560 x 1440,240hz,lenovo,exceeding unknown USD
"Suggest laptops presented by microsoft, with the following features ryzen 9 4th along with amd radeon rx 6800s next to 32gb ram with display resolution qhd accompanied by 60hz capable of running AAA games Maximum spending limit: 2774 dollars..",ryzen 9 4th,amd radeon rx 6800s,32gb ram,display resolution qhd,60hz,microsoft,Maximum spending limit: 2774 dollars.
"ryzen 7 , nvidia t500 alongside ram 96gb coupled with resolution 2880 x 1800 not to mention 360hz laptop presented by hp, powerful enough to undertake ideal for running complex data visualization algorithms? circa $3169.",ryzen 7,nvidia t500,ram 96gb,resolution 2880 x 1800,360hz,hp,circa $3169
"intel core ultra 7 185 series together alongside nvidia geforce rtx 4070 and 8gb ; 2560 x 1600 resolution not to mention 300hz laptop brought to you by acer, powerful enough to realize ideal for running complex data mining algorithms? exceeding 3077.",intel core ultra 7 185 series,nvidia geforce rtx 4070,8gb,2560 x 1600 resolution,300hz,acer,exceeding 3077
"ryzen 5 pro and nvidia rtx 2000 ada with 64gb as well as screen resolution full hd & 250hz laptop engineered by hp, designed to handle capable of running the latest AAA titles? Maximum spending limit: 1356 USD..",ryzen 5 pro,nvidia rtx 2000 ada,64gb,screen resolution full hd,250hz,hp,Maximum spending limit: 1356 USD.
"amd ryzen ai 9 365 together with nvidia geforce rtx 4080 , ram 12gb alongside 1920 x 1080 coupled with 144hz laptop . This product belongs to msi, powerful enough to perform ideal for running complex data visualization algorithms? greater than $1528.",amd ryzen ai 9 365,nvidia geforce rtx 4080,ram 12gb,1920 x 1080,144hz,msi,greater than $1528
"intel core i7 13 series in addition to nvidia geforce rtx 3070 ti joined by 40gb & resolution wqxga+ (16:10) coupled with 120hz laptop . It is a xpg product, optimized for ideal for running complex data analytics algorithms tasks? in the neighborhood of unknown.",intel core i7 13 series,nvidia geforce rtx 3070 ti,40gb,resolution wqxga+ (16:10),120hz,xpg,in the neighborhood of unknown
"core i7 as well amd radeon rx 7600s along with ram 16gb besides 1920 x 1080 not to mention 360hz laptop . It is designed by lenovo, efficient for suitable for running enterprise-level software performance? in the neighborhood of 1788 USD.",core i7,amd radeon rx 7600s,ram 16gb,1920 x 1080,360hz,lenovo,in the neighborhood of 1788 USD
"Could you find a laptop . A razer exclusive, with these features ryzen 7 pro along with nvidia mx330 with 32gb , retina-like display panel as well 300hz designed for high-performance data visualization above 1407 USD.",ryzen 7 pro,nvidia mx330,32gb,retina-like display panel,300hz,razer,above 1407 USD
"intel core i7 13620h next to nvidia rtx 3070 ti along with 128gb ram together alongside 3072 x 1920 plus 360hz laptop . It is endorsed by xmg, efficient for capable of handling large-scale data analytics achievement? a little less than 2291 dollars.",intel core i7 13620h,nvidia rtx 3070 ti,128gb ram,3072 x 1920,360hz,xmg,a little less than 2291 dollars
"Suggest powerful laptops . A hp exclusive, with amd ryzen 7 8th as well nvidia rtx a5000  together with 40gb along with 2560 x 1440 display alongside 250hz capable of handling multiple applications simultaneously almost 3082 USD.",amd ryzen 7 8th,nvidia rtx a5000 ,40gb,2560 x 1440 display,250hz,hp,almost 3082 USD
"ryzen 7 & nvidia rtx a2000 together alongside ram 32gb , screen resolution 2880 x 1620 ; 300hz laptop . This item is created by gigabyte, efficient for optimized for running advanced data analytics tools control? Budget ceiling is set at 3284 USD..",ryzen 7,nvidia rtx a2000,ram 32gb,screen resolution 2880 x 1620,300hz,gigabyte,Budget ceiling is set at 3284 USD.
"intel core i7 14th combined with nvidia rtx 3080 and 16gb ram besides 1920 x 1080 screen resolution joined by 300hz laptop . It is offered by xpg, best for suitable for running high-performance data mining software? and under 3245.",intel core i7 14th,nvidia rtx 3080,16gb ram,1920 x 1080 screen resolution,300hz,xpg,and under 3245
"Suggest some laptops . It is manufactured by xmg, having these features intel core i7 14th not to mention rtx a3000 alongside 48gb next to 1920 x 1080 together with 165hz designed for high-performance data visualization approximately 3303.",intel core i7 14th,rtx a3000,48gb,1920 x 1080,165hz,xmg,approximately 3303
"ryzen 7 gen 6 next to rtx 3060 accompanied by 96gb together with resolution qhd+ along with 360hz laptop . The brand behind this product is dell, perfect for optimized for running advanced data modeling tools needs? within the interval of unknown USD to 1498 USD.",ryzen 7 gen 6,rtx 3060,96gb,resolution qhd+,360hz,dell,within the interval of unknown USD to 1498 USD
"Does your selection include laptops curated by hp, that core i5 11th joined by nvidia rtx a3000 together alongside 40gb besides resolution 2400 x 1600 together with 250hz ideal for running complex data visualization algorithms not exceeding $1567.",core i5 11th,nvidia rtx a3000,40gb,resolution 2400 x 1600,250hz,hp,not exceeding $1567
"amd ryzen 9 pro 7940hs together with nvidia rtx a5500 not to mention ram 40gb as well as qhd+ 16:9 display coupled with 60hz laptop brought to you by asus, efficient for capable of handling large-scale data modeling? close to $unknown.",amd ryzen 9 pro 7940hs,nvidia rtx a5500,ram 40gb,qhd+ 16:9 display,60hz,asus,close to $unknown
"Can you show me some laptops assembled by xpg, with intel core i9 9th joined by geforce rtx 3050 ti , ram 128gb with 16:10 hd+ display resolution together alongside 240hz perfect for 3D modeling and rendering The maximum budget is 2160 USD..",intel core i9 9th,geforce rtx 3050 ti,ram 128gb,16:10 hd+ display resolution,240hz,xpg,The maximum budget is 2160 USD.
"Could you suggest laptops . This item comes courtesy of microsoft, having core i9 and nvidia t500 in addition to 8gb ram combined with wqhd display besides 250hz optimized for running advanced machine learning algorithms in the vicinity of unknown USD.",core i9,nvidia t500,8gb ram,wqhd display,250hz,microsoft,in the vicinity of unknown USD
"Looking for laptops created by the team at lg, equipped with ryzen 9 as well as nvidia rtx a5500 and 32gb with display 2400 x 1600 ; 240hz optimized for running big data applications up to a maximum of $unknown can be spent..",ryzen 9,nvidia rtx a5500,32gb,display 2400 x 1600,240hz,lg,up to a maximum of $unknown can be spent.
"intel core i9 10980hk accompanied by nvidia geforce rtx 4090 as well as ram 32gb not to mention 3.5k display panel besides 120hz laptop . This item is created by lenovo, optimized for ideal for running complex data visualization algorithms management? roughly 3481.",intel core i9 10980hk,nvidia geforce rtx 4090,ram 32gb,3.5k display panel,120hz,lenovo,roughly 3481
"Recommend laptops presented by samsung, equipped with ryzen 7 pro with amd radeon rx 6800s as well as ram 40gb and display resolution 4k besides 120hz capable of handling large-scale data visualization I am limited to a maximum budget of 1636 USD..",ryzen 7 pro,amd radeon rx 6800s,ram 40gb,display resolution 4k,120hz,samsung,I am limited to a maximum budget of 1636 USD.
"Seeking laptops crafted by acer, including these features ryzen 9 joined by geforce rtx 4090 together with 8gb as well as display resolution 2560 x 1600 coupled with 480hz ideal for running complex data analysis models just about unknown dollars.",ryzen 9,geforce rtx 4090,8gb,display resolution 2560 x 1600,480hz,acer,just about unknown dollars
"amd ryzen ai 7 gen 6 besides nvidia rtx 3080 alongside 32gb next to 16-inch retina display together alongside 60hz laptop developed in-house by samsung, perfect for ideal for running complex data mining algorithms progress? around 2373 USD.",amd ryzen ai 7 gen 6,nvidia rtx 3080,32gb,16-inch retina display,60hz,samsung,around 2373 USD
"What are your top picks for laptops engineered by xmg, having core i5 together alongside geforce rtx 4050 , ram 12gb and 3,5k display resolution along with 90hz optimized for running resource-intensive games approximately unknown.",core i5,geforce rtx 4050,ram 12gb,"3,5k display resolution",90hz,xmg,approximately unknown
"Find high-performance laptops brought to life by acer, that include intel core ultra 7 185 series not to mention rx 7600s as well 128gb together with 3k display panel together alongside 120hz optimized for running data visualization tools greater than 3365 USD.",intel core ultra 7 185 series,rx 7600s,128gb,3k display panel,120hz,acer,greater than 3365 USD
"Inquiring about laptops created by the team at xpg, with these features core ultra 7 as well as rtx 3000 ada together alongside 16gb and 2560 x 1600 screen resolution along with 250hz capable of handling large datasets ranging from 2312 to unknown.",core ultra 7,rtx 3000 ada,16gb,2560 x 1600 screen resolution,250hz,xpg,ranging from 2312 to unknown
"Could you recommend laptops engineered by hp, with the following:  intel core ultra 9 185h next to nvidia rtx a2000 not to mention ram 16gb along with qhd monitor resolution together alongside 240hz suitable for running statistical analysis software over 3364 dollars.",intel core ultra 9 185h,nvidia rtx a2000,ram 16gb,qhd monitor resolution,240hz,hp,over 3364 dollars
"Looking for laptops . This product belongs to asus, equipped with core i5 10th with geforce rtx 3080 together alongside 8gb ram together with wquxga display and 60hz designed for high-performance data visualization close to unknown dollars.",core i5 10th,geforce rtx 3080,8gb ram,wquxga display,60hz,asus,close to unknown dollars
"intel core i7 12650h coupled with rx 7600s as well 128gb ram , 16-inch retina screen resolution with 144hz laptop crafted by lenovo, efficient for capable of handling large-scale data analysis regulation? in excess of 1677 USD.",intel core i7 12650h,rx 7600s,128gb ram,16-inch retina screen resolution,144hz,lenovo,in excess of 1677 USD
"core ultra 7 as well nvidia rtx a500 together with 16gb , retina-like display along with 300hz laptop . It is designed by razer, powerful enough to run suitable for running high-performance data analysis software? more than unknown USD.",core ultra 7,nvidia rtx a500,16gb,retina-like display,300hz,razer,more than unknown USD
"What kinds of laptops curated by lg, include intel core i9 12th accompanied by nvidia rtx a2000 in addition to 128gb plus display panel 3840 x 2160 joined by 250hz designed for high-speed data processing on the order of 1599 USD.",intel core i9 12th,nvidia rtx a2000,128gb,display panel 3840 x 2160,250hz,lg,on the order of 1599 USD
"I am on the lookout for laptops produced with care by xmg, with amd ryzen 9 6th not to mention nvidia geforce rtx 2070 in addition to ram 32gb plus display resolution qhd alongside 90hz ideal for running complex 3D simulations I am limited to a maximum budget of 2420..",amd ryzen 9 6th,nvidia geforce rtx 2070,ram 32gb,display resolution qhd,90hz,xmg,I am limited to a maximum budget of 2420.
"core i5 not to mention mx330 plus 16gb ram as well screen resolution 4k ; 144hz laptop . The brand behind this product is samsung, best for suitable for running high-performance computing tasks? from 2064 dollars to unknown dollars.",core i5,mx330,16gb ram,screen resolution 4k,144hz,samsung,from 2064 dollars to unknown dollars
"In need of help finding laptops . This item comes courtesy of lenovo, having intel core i7 13700h coupled with mx330 as well 64gb joined by monitor resolution 2880 x 1620 besides 90hz ideal for streaming and content creation extending from $unknown to $2997.",intel core i7 13700h,mx330,64gb,monitor resolution 2880 x 1620,90hz,lenovo,extending from $unknown to $2997
"ryzen 7 gen 5 together alongside nvidia rtx 4060 next to ram 128gb , resolution retina 16 together with 240hz laptop . The brand behind this product is acer, designed for designed for high-speed data analysis scenarios? The maximum amount I can spend is 2597 dollars..",ryzen 7 gen 5,nvidia rtx 4060,ram 128gb,resolution retina 16,240hz,acer,The maximum amount I can spend is 2597 dollars.
"core i5 and nvidia t500 & 64gb ram plus 3200 x 2000 accompanied by 144hz laptop presented by hp, equipped for capable of running deep learning models challenges? covering 3302 dollars to unknown dollars.",core i5,nvidia t500,64gb ram,3200 x 2000,144hz,hp,covering 3302 dollars to unknown dollars
"ryzen 7 alongside nvidia geforce rtx 4050 & ram 16gb plus resolution 3k5 coupled with 144hz laptop . It is endorsed by razer, capable of mastering designed for high-speed data mining? surpassing 3179 USD.",ryzen 7,nvidia geforce rtx 4050,ram 16gb,resolution 3k5,144hz,razer,surpassing 3179 USD
"Which laptops engineered by lenovo, would you recommend featuring amd ryzen 9 5900hx coupled with nvidia geforce rtx 4090 joined by ram 24gb next to retina-like display resolution ; 165hz suitable for running high-performance data analysis software beyond 3396 dollars.",amd ryzen 9 5900hx,nvidia geforce rtx 4090,ram 24gb,retina-like display resolution,165hz,lenovo,beyond 3396 dollars
"intel core i5 14450hx along with nvidia geforce rtx 4050 combined with 24gb as well as display resolution 3840 x 2160 joined by 300hz laptop . It is a razer product, designed for ideal for running complex data visualization algorithms ? and under $unknown.",intel core i5 14450hx,nvidia geforce rtx 4050,24gb,display resolution 3840 x 2160,300hz,razer,and under $unknown
"Show me laptops . This item comes courtesy of microsoft, that are equipped with core i7 14th together with nvidia geforce rtx 4070 accompanied by ram 48gb besides retina 16 display resolution with 250hz optimized for running cloud-based applications Budget ceiling is set at 1843..",core i7 14th,nvidia geforce rtx 4070,ram 48gb,retina 16 display resolution,250hz,microsoft,Budget ceiling is set at 1843.
"amd ryzen 5 5th & nvidia geforce mx330 accompanied by 32gb together alongside wqhd display resolution as well as 360hz laptop created by the team at hp, efficient for optimized for running advanced data mining tools control? just under 1828.",amd ryzen 5 5th,nvidia geforce mx330,32gb,wqhd display resolution,360hz,hp,just under 1828
"Suggestions for laptops . This item comes courtesy of razer, with these features intel core i7 1260p and nvidia geforce mx330 ; 96gb & monitor resolution 16:10 4k+ next to 90hz optimized for running advanced machine learning algorithms extending from $unknown to $1945.",intel core i7 1260p,nvidia geforce mx330,96gb,monitor resolution 16:10 4k+,90hz,razer,extending from $unknown to $1945
"Looking for laptops brought to you by gigabyte, that have intel core i7 14650hx together with nvidia geforce rtx 2050 ; ram 96gb together alongside 3072 x 1920 joined by 120hz designed for high-performance data modeling Budget ceiling is set at 1392 USD..",intel core i7 14650hx,nvidia geforce rtx 2050,ram 96gb,3072 x 1920,120hz,gigabyte,Budget ceiling is set at 1392 USD.
"I am in the market for a laptop brought to life by acer, including ryzen 7 pro gen 5 as well rx 7600s and 128gb as well as screen resolution 3k2k (16:9) combined with 120hz capable of handling multiple applications simultaneously not exceeding $unknown.",ryzen 7 pro gen 5,rx 7600s,128gb,screen resolution 3k2k (16:9),120hz,acer,not exceeding $unknown
"In the market for laptops . It is manufactured by samsung, having ryzen 5 pro 5th ; nvidia rtx a3000 together with 12gb ram as well as display panel full hd and 360hz designed for high-speed data mining between unknown and 3378.",ryzen 5 pro 5th,nvidia rtx a3000,12gb ram,display panel full hd,360hz,samsung,between unknown and 3378
"Excited about laptops . It is developed by xpg, having ryzen ai 9 joined by nvidia geforce rtx 3050 ti as well 40gb accompanied by 3:2 display monitor resolution as well as 360hz suitable for running complex simulations The maximum allowable budget is unknown dollars..",ryzen ai 9,nvidia geforce rtx 3050 ti,40gb,3:2 display monitor resolution,360hz,xpg,The maximum allowable budget is unknown dollars.
"What kinds of laptops . This item comes courtesy of msi, can be found with ryzen 9 pro 7th as well as nvidia rtx a3000 joined by 96gb as well screen resolution 2560 x 1440 & 165hz capable of running AAA games more or less 1588 USD.",ryzen 9 pro 7th,nvidia rtx a3000,96gb,screen resolution 2560 x 1440,165hz,msi,more or less 1588 USD
"core i9 & nvidia geforce rtx 4070 together with ram 24gb and display qhd+ alongside 300hz laptop brought to life by hp, capable of performing perfect for 3D modeling and rendering? fluctuating between 2190 and 3114.",core i9,nvidia geforce rtx 4070,ram 24gb,display qhd+,300hz,hp,fluctuating between 2190 and 3114
"ryzen ai 9 7th coupled with nvidia geforce rtx 3080 besides ram 16gb and display resolution hd+ (16:10) in addition to 144hz laptop . An innovation from hp, powerful enough to tackle optimized for running advanced gaming graphics? a little less than unknown USD.",ryzen ai 9 7th,nvidia geforce rtx 3080,ram 16gb,display resolution hd+ (16:10),144hz,hp,a little less than unknown USD
"core i9 plus amd radeon rx 6800s next to 128gb ram as well as 1920 x 1200 alongside 360hz laptop engineered by razer, ideal for suitable for running high-end graphics applications innovation? I am limited to a maximum budget of unknown USD..",core i9,amd radeon rx 6800s,128gb ram,1920 x 1200,360hz,razer,I am limited to a maximum budget of unknown USD.
"Recommendations for laptops . This item is created by gigabyte, that feature ryzen 7 with rtx 3070 ti combined with ram 128gb accompanied by monitor resolution 16:9 qhd+ as well as 360hz ideal for running complex data visualization algorithms circa 2949.",ryzen 7,rtx 3070 ti,ram 128gb,monitor resolution 16:9 qhd+,360hz,gigabyte,circa 2949
"amd ryzen 5 7640hs as well as nvidia rtx 4090 ; 64gb along with monitor resolution 3:2 display in addition to 250hz laptop created by the team at razer, capable of supporting designed for high-performance data visualization? in the vicinity of $3020.",amd ryzen 5 7640hs,nvidia rtx 4090,64gb,monitor resolution 3:2 display,250hz,razer,in the vicinity of $3020
"amd ryzen ai 5 gen 4 not to mention geforce rtx 4070 together with 128gb ram plus display resolution qhd+ (16:10) joined by 360hz laptop . The brand behind this product is microsoft, designed for designed for high-performance data visualization? a bit under 3342.",amd ryzen ai 5 gen 4,geforce rtx 4070,128gb ram,display resolution qhd+ (16:10),360hz,microsoft,a bit under 3342
"Would you mind suggesting laptops . It is designed by msi, that come with intel core ultra 9 185 series joined by rtx 2080 super max-q besides 32gb alongside display quad hd together with 165hz designed for high-resolution gaming a bit under 1604 USD.",intel core ultra 9 185 series,rtx 2080 super max-q,32gb,display quad hd,165hz,msi,a bit under 1604 USD
"core i5 gen 13 along with nvidia rtx a3000  together alongside 8gb ram as well hd+ (16:10) display accompanied by 480hz laptop . It is produced by msi, efficient for optimized for running resource-intensive applications development? The maximum allowable budget is 3423..",core i5 gen 13,nvidia rtx a3000 ,8gb ram,hd+ (16:10) display,480hz,msi,The maximum allowable budget is 3423.
"Please suggest some laptops . This item comes courtesy of gigabyte, having ryzen 9 pro gen 7 plus geforce mx330 together alongside 48gb , display resolution 3.5k not to mention 120hz optimized for running big data applications in excess of 1353 USD.",ryzen 9 pro gen 7,geforce mx330,48gb,display resolution 3.5k,120hz,gigabyte,in excess of 1353 USD
"intel core ultra 9 185 series , radeon rx 6650m as well as 8gb not to mention retina-like monitor resolution coupled with 300hz laptop . It is produced by gigabyte, efficient for optimized for running advanced data analytics tools achievement? fluctuating between $unknown and $3052.",intel core ultra 9 185 series,radeon rx 6650m,8gb,retina-like monitor resolution,300hz,gigabyte,fluctuating between $unknown and $3052
"intel core i9 14 series and nvidia rtx a3000 together alongside 32gb ram & 1920 x 1080 ; 250hz laptop . It is manufactured by xmg, ideal for suitable for running high-performance data analysis software innovation? close to $unknown.",intel core i9 14 series,nvidia rtx a3000,32gb ram,1920 x 1080,250hz,xmg,close to $unknown
"core i9 alongside nvidia t500 in addition to ram 12gb besides display resolution 3072 x 1920 along with 165hz laptop . It is a acer product, tailored to suitable for running high-performance data mining software requirements? beyond $1815.",core i9,nvidia t500,ram 12gb,display resolution 3072 x 1920,165hz,acer,beyond $1815
"In need of help finding laptops . An innovation from asus, having core i5 as well nvidia gtx 1660 ti in addition to 96gb , wqxga+ (16:10) display resolution accompanied by 240hz optimized for running advanced statistical analysis at least 2445 USD.",core i5,nvidia gtx 1660 ti,96gb,wqxga+ (16:10) display resolution,240hz,asus,at least 2445 USD
"Require a laptop crafted by lenovo, with these features core ultra 7 in addition to nvidia rtx a2000 accompanied by 12gb next to display resolution 16:9 qhd+ and 60hz ideal for running complex data mining algorithms spanning from $1396 to $2671.",core ultra 7,nvidia rtx a2000,12gb,display resolution 16:9 qhd+,60hz,lenovo,spanning from $1396 to $2671
"Could you recommend laptops brought to life by gigabyte, with the following:  core ultra 9 as well nvidia geforce gtx 1650 ti joined by ram 48gb accompanied by display 3:2 display along with 300hz suitable for running enterprise-level software in the neighborhood of unknown dollars.",core ultra 9,nvidia geforce gtx 1650 ti,ram 48gb,display 3:2 display,300hz,gigabyte,in the neighborhood of unknown dollars
"core ultra 9 as well as nvidia geforce rtx 2080 super max-q besides ram 40gb alongside 2880 x 1800 display resolution accompanied by 300hz laptop . It is produced by razer, ideal for suitable for running high-end CAD software endeavors? nearly $3469.",core ultra 9,nvidia geforce rtx 2080 super max-q,ram 40gb,2880 x 1800 display resolution,300hz,razer,nearly $3469
"ryzen 9 ; geforce rtx 3050 ti accompanied by ram 32gb besides 4k uhd display resolution as well as 60hz laptop curated by hp, tailored for designed for high-speed data visualization completion? on the order of $1790.",ryzen 9,geforce rtx 3050 ti,ram 32gb,4k uhd display resolution,60hz,hp,on the order of $1790
"amd ryzen 9 7945hx coupled with nvidia rtx 2000 ada with 16gb , display 3072p & 90hz laptop curated by acer, perfect for optimized for running advanced gaming graphics satisfaction? between unknown and 1586.",amd ryzen 9 7945hx,nvidia rtx 2000 ada,16gb,display 3072p,90hz,acer,between unknown and 1586
"ryzen ai 7 and nvidia geforce rtx 3050 ti as well as 64gb together with display uhd next to 60hz laptop brought to you by razer, efficient for suitable for running high-performance data modeling software performance? slightly below unknown dollars.",ryzen ai 7,nvidia geforce rtx 3050 ti,64gb,display uhd,60hz,razer,slightly below unknown dollars
"amd ryzen 7 7735hs ; gtx 1650 ti next to 64gb ram & display resolution 3840 x 2160 and 165hz laptop . This item comes courtesy of xpg, efficient for optimized for running advanced data modeling tools regulation? not exceeding a budget of 1537 USD..",amd ryzen 7 7735hs,gtx 1650 ti,64gb ram,display resolution 3840 x 2160,165hz,xpg,not exceeding a budget of 1537 USD.
"ryzen 9 as well as amd radeon rx 7700s along with ram 128gb alongside screen resolution 3840 x 2400 not to mention 240hz laptop engineered by xpg, capable of ruling designed for high-performance data modeling? Budget ceiling is set at 2303 USD..",ryzen 9,amd radeon rx 7700s,ram 128gb,screen resolution 3840 x 2400,240hz,xpg,Budget ceiling is set at 2303 USD.
"amd ryzen 9 6900hx coupled with nvidia geforce rtx 3060 as well ram 128gb besides monitor resolution wqhd joined by 300hz laptop brought to life by microsoft, capable of overseeing suitable for running high-performance data analytics software? between $1692 and $2172.",amd ryzen 9 6900hx,nvidia geforce rtx 3060,ram 128gb,monitor resolution wqhd,300hz,microsoft,between $1692 and $2172
