question,cpu,gpu,ram,display,refresh rate,brand,price
"Recommend laptops . This product belongs to asus, with these specifications ryzen ai 5 next to nvidia t500 & 64gb together alongside display 2k as well 480hz suitable for running complex simulations spanning from $1827 to $2473.",ryzen ai 5,nvidia t500,64gb,display 2k,480hz,asus,spanning from $1827 to $2473
"amd ryzen ai 9 gen 6 along with gtx 1650 alongside 128gb in addition to screen resolution qhd+ (16:10) not to mention 360hz laptop assembled by lenovo, powerful enough for suitable for running high-end CAD software? Maximum spending limit: 2676 dollars..",amd ryzen ai 9 gen 6,gtx 1650,128gb,screen resolution qhd+ (16:10),360hz,lenovo,Maximum spending limit: 2676 dollars.
"ryzen ai 9 5th as well geforce rtx 3080 as well as ram 96gb , hd+ (16:10) screen resolution next to 90hz laptop brought to you by acer, designed to meet designed for high-performance gaming standards? in excess of 2215 dollars.",ryzen ai 9 5th,geforce rtx 3080,ram 96gb,hd+ (16:10) screen resolution,90hz,acer,in excess of 2215 dollars
"Looking for laptops curated by gigabyte, in your inventory that intel core i9 11980hk together alongside radeon rx 6800s plus 24gb along with display panel 1920 x 1200 , 90hz capable of handling large-scale data analytics about $1971.",intel core i9 11980hk,radeon rx 6800s,24gb,display panel 1920 x 1200,90hz,gigabyte,about $1971
"I am looking for laptops produced with care by dell, equipped with ryzen 9 pro with geforce rtx 2060 together alongside 128gb next to display panel 2160p not to mention 60hz designed for high-speed data mining more than 2007 USD.",ryzen 9 pro,geforce rtx 2060,128gb,display panel 2160p,60hz,dell,more than 2007 USD
"Let’s look at laptops . An innovation from microsoft, equipped with amd ryzen 9 8945hs not to mention nvidia geforce rtx 3050 ti joined by 64gb ram alongside screen resolution wqhd as well 90hz suitable for running virtual reality applications about unknown dollars.",amd ryzen 9 8945hs,nvidia geforce rtx 3050 ti,64gb ram,screen resolution wqhd,90hz,microsoft,about unknown dollars
"Require a laptop crafted by dell, with these features amd ryzen 9 7945hx accompanied by nvidia rtx 2000 ada , 8gb ram in addition to 3k5 screen resolution along with 144hz designed for high-performance data visualization up to a maximum of $3430 can be spent..",amd ryzen 9 7945hx,nvidia rtx 2000 ada,8gb ram,3k5 screen resolution,144hz,dell,up to a maximum of $3430 can be spent.
"intel core i9 12900h together alongside rtx 4080 not to mention 32gb ram alongside screen resolution 3840 x 2160 , 360hz laptop brought to life by microsoft, efficient for perfect for 3D modeling and rendering workflows? close to $unknown.",intel core i9 12900h,rtx 4080,32gb ram,screen resolution 3840 x 2160,360hz,microsoft,close to $unknown
"Do you offer laptops designed exclusively by razer, with core ultra 9 185 series along with nvidia geforce rtx 3080 as well as ram 24gb together with resolution ultra hd plus 480hz ideal for running complex data modeling software at least 1319 USD.",core ultra 9 185 series,nvidia geforce rtx 3080,ram 24gb,resolution ultra hd,480hz,razer,at least 1319 USD
"Which laptops . It is offered by gigabyte, should I consider with ryzen 9 in addition to nvidia rtx a5000 besides 32gb plus 3k5 resolution as well 90hz suitable for running high-performance data analysis software nearly 2816.",ryzen 9,nvidia rtx a5000,32gb,3k5 resolution,90hz,gigabyte,nearly 2816
"Which laptops . It is endorsed by hp, do you have that feature amd ryzen 9 6900hx as well as radeon rx 6800s next to 40gb ram ; 3840 x 2400 screen resolution with 250hz ideal for running complex data analytics algorithms almost 3082 dollars.",amd ryzen 9 6900hx,radeon rx 6800s,40gb ram,3840 x 2400 screen resolution,250hz,hp,almost 3082 dollars
"Please suggest laptops brought to you by microsoft, with amd ryzen 9 7th together alongside amd radeon rx 6650m and ram 40gb next to wide quad ultra extended screen resolution plus 300hz ideal for streaming and content creation in excess of 3144 USD.",amd ryzen 9 7th,amd radeon rx 6650m,ram 40gb,wide quad ultra extended screen resolution,300hz,microsoft,in excess of 3144 USD
"Suggestions for laptops . This product belongs to microsoft, with these features core ultra 7 185 series besides nvidia rtx a500 accompanied by 64gb and display 3072p next to 240hz designed for high-performance audio production exceeding 2987 USD.",core ultra 7 185 series,nvidia rtx a500,64gb,display 3072p,240hz,microsoft,exceeding 2987 USD
"Assistance in finding laptops . This item comes courtesy of xmg, equipped with ryzen ai 9 & radeon rx 6500m next to 48gb ram joined by 4k monitor resolution combined with 165hz optimized for running advanced gaming graphics greater than $1458.",ryzen ai 9,radeon rx 6500m,48gb ram,4k monitor resolution,165hz,xmg,greater than $1458
"ryzen 7 besides nvidia geforce rtx 2050 and 12gb ram next to display fhd as well as 120hz laptop assembled by dell, capable of facilitating suitable for running high-performance data analysis software? ranging from unknown USD to 2653 USD.",ryzen 7,nvidia geforce rtx 2050,12gb ram,display fhd,120hz,dell,ranging from unknown USD to 2653 USD
"Please give me suggestions for laptops . It is offered by hp, with intel core i9 gen 11 along with nvidia rtx a5000  ; 64gb ram coupled with monitor resolution qhd plus 360hz ideal for running complex data visualization algorithms circa 3214.",intel core i9 gen 11,nvidia rtx a5000 ,64gb ram,monitor resolution qhd,360hz,hp,circa 3214
"ryzen 7 pro next to geforce rtx 3070 joined by 12gb coupled with full hd monitor resolution together alongside 300hz laptop made possible by lg, suitable for designed for high-performance data visualization applications? covering unknown to 1307.",ryzen 7 pro,geforce rtx 3070,12gb,full hd monitor resolution,300hz,lg,covering unknown to 1307
"ryzen ai 7 5th plus geforce rtx 3080 combined with ram 128gb as well as 1920 x 1200 next to 144hz laptop . This item is created by hp, tailored for designed for high-performance project? My budget cap is $2739..",ryzen ai 7 5th,geforce rtx 3080,ram 128gb,1920 x 1200,144hz,hp,My budget cap is $2739.
"core i9 next to rx 7600s along with 48gb besides 3072 x 1920 ; 300hz laptop brought to you by lenovo, capable of facilitating designed for high-performance data modeling? just under unknown dollars.",core i9,rx 7600s,48gb,3072 x 1920,300hz,lenovo,just under unknown dollars
"High-powered laptops . It is a asus product, that include intel core i5 gen 11 accompanied by nvidia geforce rtx 4080 not to mention 12gb ram along with display panel 2400 x 1600 together with 250hz suitable for running statistical analysis software The expenditure limit is $1739..",intel core i5 gen 11,nvidia geforce rtx 4080,12gb ram,display panel 2400 x 1600,250hz,asus,The expenditure limit is $1739.
"core i9 gen 14 & nvidia geforce rtx 3070 ti not to mention ram 32gb ; 2560 x 1440 with 240hz laptop . It is a acer product, ideal for ideal for running complex data mining algorithms command? and I can spent under 1538 USD.",core i9 gen 14,nvidia geforce rtx 3070 ti,ram 32gb,2560 x 1440,240hz,acer,and I can spent under 1538 USD
"Suggest some laptops . This item comes courtesy of lenovo, with core i5 along with nvidia rtx 2080 super max-q and ram 16gb , monitor resolution wuxga together with 60hz designed for high-performance scientific research above 1510.",core i5,nvidia rtx 2080 super max-q,ram 16gb,monitor resolution wuxga,60hz,lenovo,above 1510
"Aim to find laptops assembled by xmg, having ryzen 7 pro gen 4 not to mention geforce rtx 2080 super max-q combined with ram 32gb accompanied by monitor resolution 3840 x 2400 joined by 165hz use for data analysis tasks around unknown dollars.",ryzen 7 pro gen 4,geforce rtx 2080 super max-q,ram 32gb,monitor resolution 3840 x 2400,165hz,xmg,around unknown dollars
"Recommend laptops . This item is created by hp, with these specifications amd ryzen 7 gen 7 along with geforce rtx 4090 as well ram 40gb with display retina-like , 120hz suitable for running high-performance data analytics software in the region of 2226 dollars.",amd ryzen 7 gen 7,geforce rtx 4090,ram 40gb,display retina-like,120hz,hp,in the region of 2226 dollars
"intel core i7 13700hx alongside nvidia rtx a1000 as well 96gb as well as 3:2 display display panel with 90hz laptop . This item comes courtesy of xpg, tailored for designed for high-performance data mining completion? not exceeding a budget of 2075..",intel core i7 13700hx,nvidia rtx a1000,96gb,3:2 display display panel,90hz,xpg,not exceeding a budget of 2075.
"Looking for laptops brought to you by gigabyte, in your inventory that amd ryzen 9 5900hs ; nvidia geforce gtx 1660 ti in addition to 128gb ram plus 2880 x 1620 & 360hz optimized for running advanced data analytics tools just under 2000.",amd ryzen 9 5900hs,nvidia geforce gtx 1660 ti,128gb ram,2880 x 1620,360hz,gigabyte,just under 2000
"In the process of finding laptops engineered by lenovo, equipped with ryzen 9 together with nvidia rtx a2000 combined with ram 24gb accompanied by retina 15 monitor resolution plus 144hz designed for high-performance within the interval of 2049 dollars to unknown dollars.",ryzen 9,nvidia rtx a2000,ram 24gb,retina 15 monitor resolution,144hz,lenovo,within the interval of 2049 dollars to unknown dollars
"Looking to find laptops made possible by acer, with these features ryzen 9 gen 7 , nvidia geforce rtx 3060 and 40gb as well 3k display resolution ; 144hz ideal for content creation and multimedia editing just about 1760.",ryzen 9 gen 7,nvidia geforce rtx 3060,40gb,3k display resolution,144hz,acer,just about 1760
"amd ryzen 5 7640hs ; nvidia rtx a1000 alongside 16gb ram plus 3840 x 2160 together with 120hz laptop . The brand behind this product is xmg, perfect for suitable for running high-performance data mining software fulfillment? The expenditure limit is 1808 USD..",amd ryzen 5 7640hs,nvidia rtx a1000,16gb ram,3840 x 2160,120hz,xmg,The expenditure limit is 1808 USD.
"amd ryzen 7 pro gen 4 plus nvidia geforce rtx 3060 , 128gb and full hd resolution along with 90hz laptop presented by asus, tailored for capable of running deep learning models coordination? not exceeding a budget of 3291..",amd ryzen 7 pro gen 4,nvidia geforce rtx 3060,128gb,full hd resolution,90hz,asus,not exceeding a budget of 3291.
"Seeking laptops developed in-house by dell, including these features core i5 gen 13 combined with mx330 , 32gb along with monitor resolution triple hd not to mention 90hz capable of handling high-resolution displays around 2058 USD.",core i5 gen 13,mx330,32gb,monitor resolution triple hd,90hz,dell,around 2058 USD
"intel core ultra 7 155 series along with nvidia geforce rtx 2060 combined with 96gb plus display triple hd alongside 90hz laptop created by the team at msi, designed for designed for high-performance data visualization ? between unknown USD and 1406 USD.",intel core ultra 7 155 series,nvidia geforce rtx 2060,96gb,display triple hd,90hz,msi,between unknown USD and 1406 USD
"Can you provide a list of laptops . It is a msi product, featuring amd ryzen 7 8th besides geforce rtx 3080 ti along with 16gb ram alongside 3k2k (16:9) resolution with 144hz optimized for running advanced statistical analysis I can spent about 1804.",amd ryzen 7 8th,geforce rtx 3080 ti,16gb ram,3k2k (16:9) resolution,144hz,msi,I can spent about 1804
"Looking for laptops developed in-house by gigabyte, that include ryzen 9 as well nvidia geforce rtx 3080 accompanied by 12gb plus display resolution 2400 x 1600 and 360hz optimized for running advanced statistical analysis up to a maximum of $1404 can be spent..",ryzen 9,nvidia geforce rtx 3080,12gb,display resolution 2400 x 1600,360hz,gigabyte,up to a maximum of $1404 can be spent.
"Suggest robust laptops . The brand behind this product is acer, featuring intel core i7 11th & nvidia geforce rtx 4080 and 16gb ram joined by screen resolution 3:2 display ; 90hz suitable for running high-performance data mining tools exceeding unknown dollars.",intel core i7 11th,nvidia geforce rtx 4080,16gb ram,screen resolution 3:2 display,90hz,acer,exceeding unknown dollars
"Thinking of looking for laptops crafted by msi, that have core ultra 7 in addition to nvidia rtx a500 with 12gb alongside monitor resolution 2560 x 1440 as well as 60hz ideal for running complex data visualization algorithms Budget ceiling is set at unknown dollars..",core ultra 7,nvidia rtx a500,12gb,monitor resolution 2560 x 1440,60hz,msi,Budget ceiling is set at unknown dollars.
"amd ryzen 7 4800h combined with amd radeon rx 6800s as well 40gb and qhd+ 16:9 display , 60hz laptop . This item comes courtesy of gigabyte, optimized for capable of handling large-scale data mining activity? circa unknown.",amd ryzen 7 4800h,amd radeon rx 6800s,40gb,qhd+ 16:9 display,60hz,gigabyte,circa unknown
"Do you offer laptops . The brand behind this product is xmg, with intel core i7 11800h along with nvidia rtx a2000 plus 64gb ram & display resolution 3k2k in addition to 240hz suitable for running high-performance data analytics software above unknown USD.",intel core i7 11800h,nvidia rtx a2000,64gb ram,display resolution 3k2k,240hz,xmg,above unknown USD
"Could you recommend laptops . It is designed by razer, with the following:  core i7 14th together with nvidia geforce gtx 1650 coupled with 32gb ram plus resolution 2560 x 1440 as well as 144hz optimized for running advanced data analytics tools in the ballpark of $unknown.",core i7 14th,nvidia geforce gtx 1650,32gb ram,resolution 2560 x 1440,144hz,razer,in the ballpark of $unknown
"Looking for laptops . It is designed by acer, equipped with intel core ultra 9 185 series accompanied by nvidia rtx a2000 not to mention 32gb ram besides display panel 3k2k (16:9) joined by 240hz optimized for running big data applications The maximum amount I can spend is $3383..",intel core ultra 9 185 series,nvidia rtx a2000,32gb ram,display panel 3k2k (16:9),240hz,acer,The maximum amount I can spend is $3383.
"intel core i9 13900h along with nvidia rtx a3000 ; 96gb with resolution ultra hd and 144hz laptop . It comes from microsoft, suitable for ideal for running complex financial models? in excess of 2177.",intel core i9 13900h,nvidia rtx a3000,96gb,resolution ultra hd,144hz,microsoft,in excess of 2177
"intel core i5 13450hx joined by gtx 1660 ti together with 8gb along with 3072 x 1920 in addition to 90hz laptop presented by lg, powerful enough to tackle suitable for running high-performance computing tasks? surpassing 1544.",intel core i5 13450hx,gtx 1660 ti,8gb,3072 x 1920,90hz,lg,surpassing 1544
"The laptop made possible by microsoft, needs to have intel core i7 14th and geforce rtx 2060 with 64gb as well as 2880 x 1800 accompanied by 60hz designed for high-speed data processing Budget ceiling is set at 3123 dollars..",intel core i7 14th,geforce rtx 2060,64gb,2880 x 1800,60hz,microsoft,Budget ceiling is set at 3123 dollars.
"Are there any laptops . A hp exclusive, available featuring amd ryzen 5 6th with nvidia geforce rtx 2080 super max-q , ram 128gb coupled with screen resolution wuxga besides 120hz designed for high-speed internet browsing above unknown.",amd ryzen 5 6th,nvidia geforce rtx 2080 super max-q,ram 128gb,screen resolution wuxga,120hz,hp,above unknown
"ryzen 9 plus nvidia geforce rtx 4080 and ram 24gb as well as display wide quad ultra extended combined with 240hz laptop assembled by acer, ideal for designed for high-performance data visualization innovation? The maximum budget is 3025 USD..",ryzen 9,nvidia geforce rtx 4080,ram 24gb,display wide quad ultra extended,240hz,acer,The maximum budget is 3025 USD.
"Seeking out laptops . This item is created by lenovo, that come with intel core i5 gen 13 ; nvidia rtx a500 plus 12gb ram along with retina-like resolution besides 240hz sufficient for gaming more or less 3214.",intel core i5 gen 13,nvidia rtx a500,12gb ram,retina-like resolution,240hz,lenovo,more or less 3214
"Looking for information on laptops . It is a acer product, having ryzen 9 besides nvidia rtx a2000 , 96gb coupled with display resolution 4k and 240hz capable of handling large-scale data modeling more than $unknown.",ryzen 9,nvidia rtx a2000,96gb,display resolution 4k,240hz,acer,more than $unknown
"ryzen 5 plus rtx a2000 together alongside 64gb ram & monitor resolution 2560 x 1600 as well as 300hz laptop created by the team at xpg, suitable for designed for high-speed data visualization outcomes? ranging from 1381 USD to 2989 USD.",ryzen 5,rtx a2000,64gb ram,monitor resolution 2560 x 1600,300hz,xpg,ranging from 1381 USD to 2989 USD
"Seeking out laptops . It is produced by dell, that come with intel core i7 9750h along with amd radeon rx 7600s coupled with 128gb joined by 3840 x 2160 monitor resolution and 165hz sufficient for gaming I can spent about unknown.",intel core i7 9750h,amd radeon rx 7600s,128gb,3840 x 2160 monitor resolution,165hz,dell,I can spent about unknown
"amd ryzen 9 6900hs not to mention geforce gtx 1660 ti coupled with 64gb ram together with screen resolution 3200 x 2000 joined by 165hz laptop . This product belongs to hp, powerful enough for optimized for running advanced data mining tools operations? fluctuating between unknown USD and 3032 USD.",amd ryzen 9 6900hs,geforce gtx 1660 ti,64gb ram,screen resolution 3200 x 2000,165hz,hp,fluctuating between unknown USD and 3032 USD
"intel core i9 11980hk in addition to gtx 1650 with ram 16gb not to mention 16:9 qhd+ screen resolution accompanied by 90hz laptop . It is developed by samsung, ideal for designed for high-performance data mining? above 1318 dollars.",intel core i9 11980hk,gtx 1650,ram 16gb,16:9 qhd+ screen resolution,90hz,samsung,above 1318 dollars
"Require a laptop crafted by samsung, with these features intel core ultra 9 155 series joined by amd radeon rx 6500m and 32gb as well display panel 1920 x 1200 combined with 300hz suitable for running high-performance data analytics software beyond $2339.",intel core ultra 9 155 series,amd radeon rx 6500m,32gb,display panel 1920 x 1200,300hz,samsung,beyond $2339
"Have any laptops . A xmg exclusive, available that feature intel core i7 1360p not to mention nvidia geforce rtx 4060 with 40gb ram plus resolution 3.5k coupled with 165hz capable of handling large-scale data analytics in the region of $2615.",intel core i7 1360p,nvidia geforce rtx 4060,40gb ram,resolution 3.5k,165hz,xmg,in the region of $2615
"Find high-performance laptops crafted by samsung, that include core i9 13th as well nvidia geforce rtx 3070 together alongside ram 96gb joined by 2880 x 1620 display resolution , 300hz suitable for running high-end graphics applications in the region of $unknown.",core i9 13th,nvidia geforce rtx 3070,ram 96gb,2880 x 1620 display resolution,300hz,samsung,in the region of $unknown
"Find laptops . This item comes courtesy of dell, that offer high performance, including intel core i5 12 series ; mx330 alongside 64gb ram besides monitor resolution 2560 x 1440 accompanied by 165hz suitable for running high-performance computing tasks around unknown.",intel core i5 12 series,mx330,64gb ram,monitor resolution 2560 x 1440,165hz,dell,around unknown
"In need of help finding laptops . This item comes courtesy of xmg, having amd ryzen ai 9 hx 370 coupled with rx 6800s accompanied by 32gb ram as well resolution 2560 x 1600 , 120hz optimized for running advanced statistical analysis at least $unknown.",amd ryzen ai 9 hx 370,rx 6800s,32gb ram,resolution 2560 x 1600,120hz,xmg,at least $unknown
"intel core i5 gen 11 plus nvidia geforce rtx 3070 together alongside 96gb not to mention triple hd display resolution combined with 144hz laptop . It is offered by msi, tailored for optimized for running advanced data mining tools function? I can spent about 2375.",intel core i5 gen 11,nvidia geforce rtx 3070,96gb,triple hd display resolution,144hz,msi,I can spent about 2375
"intel core i9 12900hx besides nvidia geforce rtx 4080 as well ram 96gb next to retina-like display with 250hz laptop designed exclusively by gigabyte, capable of ruling designed for high-performance data modeling? ranging from 1627 dollars to 2023 dollars.",intel core i9 12900hx,nvidia geforce rtx 4080,ram 96gb,retina-like display,250hz,gigabyte,ranging from 1627 dollars to 2023 dollars
"core i5 ; nvidia rtx 4070 and 12gb together alongside 2560 x 1600 display resolution along with 240hz laptop . A microsoft exclusive, perfect for suitable for running enterprise-level software satisfaction? roughly 2460 dollars.",core i5,nvidia rtx 4070,12gb,2560 x 1600 display resolution,240hz,microsoft,roughly 2460 dollars
"I am in the market for a laptop brought to life by acer, including ryzen 7 as well nvidia rtx a5500 and 8gb ram along with resolution 3200 x 2000 plus 144hz suitable for running high-performance databases The maximum amount I can spend is 2586 USD..",ryzen 7,nvidia rtx a5500,8gb ram,resolution 3200 x 2000,144hz,acer,The maximum amount I can spend is 2586 USD.
"Provide recommendations for laptops produced with care by msi, featuring core ultra 7 155 series next to radeon rx 7700s as well 32gb coupled with qhd+ 16:9 display combined with 120hz designed for high-speed data visualization Budget ceiling is set at $2877..",core ultra 7 155 series,radeon rx 7700s,32gb,qhd+ 16:9 display,120hz,msi,Budget ceiling is set at $2877.
"Find me a laptop . This item is created by msi, with ryzen 9 pro together with amd radeon rx 6650m as well 12gb ram not to mention retina 16 display panel in addition to 165hz capable of handling large-scale data analytics The maximum budget is unknown USD..",ryzen 9 pro,amd radeon rx 6650m,12gb ram,retina 16 display panel,165hz,msi,The maximum budget is unknown USD.
"Thinking of looking for laptops . This item is created by lg, that have ryzen ai 7 as well as nvidia rtx a1000 combined with 128gb & 3k2k display panel coupled with 165hz designed for high-performance data visualization above unknown USD.",ryzen ai 7,nvidia rtx a1000,128gb,3k2k display panel,165hz,lg,above unknown USD
"ryzen 5 6th combined with nvidia gtx 1650 ti along with 32gb ram joined by 3.5k display as well as 120hz laptop designed exclusively by msi, equipped to accomplish capable of handling large-scale data analysis? within the interval of 1565 USD to 2172 USD.",ryzen 5 6th,nvidia gtx 1650 ti,32gb ram,3.5k display,120hz,msi,within the interval of 1565 USD to 2172 USD
"Inquiring about laptops brought to life by xmg, with these features amd ryzen 5 pro 5th coupled with geforce rtx 2050 with 128gb plus monitor resolution 2400 x 1600 and 165hz optimized for running advanced data analytics tools approximately 2844.",amd ryzen 5 pro 5th,geforce rtx 2050,128gb,monitor resolution 2400 x 1600,165hz,xmg,approximately 2844
"core i7 in addition to nvidia rtx 3000 ada together alongside 128gb ram & screen resolution 16:10 4k+ next to 90hz laptop designed exclusively by microsoft, efficient for designed for high-performance data visualization workflows? within the interval of 2987 to unknown.",core i7,nvidia rtx 3000 ada,128gb ram,screen resolution 16:10 4k+,90hz,microsoft,within the interval of 2987 to unknown
"core i9 as well as gtx 1650 ti combined with 64gb ram with display panel 3k2k joined by 60hz laptop . This item comes courtesy of xmg, powerful enough for optimized for running advanced data mining tools operations? around $unknown.",core i9,gtx 1650 ti,64gb ram,display panel 3k2k,60hz,xmg,around $unknown
"In the market for laptops . This item comes courtesy of samsung, having amd ryzen ai 7 gen 5 and nvidia rtx a5500 not to mention ram 128gb accompanied by 3k2k (16:9) display resolution alongside 300hz designed for high-performance data visualization in the range of unknown USD to 3038 USD.",amd ryzen ai 7 gen 5,nvidia rtx a5500,ram 128gb,3k2k (16:9) display resolution,300hz,samsung,in the range of unknown USD to 3038 USD
"intel core i9 13950hx along with nvidia geforce gtx 1650 ti as well 8gb together alongside display panel quad extended (16:10) and 165hz laptop . It is a lg product, efficient for optimized for running advanced gaming graphics workflows? in excess of 3311 USD.",intel core i9 13950hx,nvidia geforce gtx 1650 ti,8gb,display panel quad extended (16:10),165hz,lg,in excess of 3311 USD
"Available laptops . This item comes courtesy of asus, that include core i9 & nvidia geforce rtx 4070 as well ram 12gb plus 3840 x 2400 , 165hz capable of handling large-scale data visualization I can spent about 2348 USD.",core i9,nvidia geforce rtx 4070,ram 12gb,3840 x 2400,165hz,asus,I can spent about 2348 USD
"Looking at the options, are there any laptops designed exclusively by lenovo, with intel core i9 13950hx plus rtx 3050 ; ram 96gb accompanied by qxga+ resolution as well as 90hz optimized for running advanced data mining tools in excess of unknown.",intel core i9 13950hx,rtx 3050,ram 96gb,qxga+ resolution,90hz,lenovo,in excess of unknown
"intel core ultra 9 155 series coupled with nvidia rtx a2000 alongside ram 40gb not to mention wqhd screen resolution and 165hz laptop developed in-house by acer, tailored for suitable for running high-performance data analytics software fulfillment? exceeding $unknown.",intel core ultra 9 155 series,nvidia rtx a2000,ram 40gb,wqhd screen resolution,165hz,acer,exceeding $unknown
"Looking for information on laptops designed exclusively by xpg, having core ultra 9 185 series ; nvidia t500 together alongside 40gb ram together with triple hd display panel besides 240hz suitable for running complex simulations at least $1522.",core ultra 9 185 series,nvidia t500,40gb ram,triple hd display panel,240hz,xpg,at least $1522
