question,cpu,gpu,ram,display,refresh rate,brand,price
"I am searching for laptops developed in-house by acer, featuring intel core ultra 9 185 series not to mention nvidia rtx a3000  accompanied by 16gb as well display resolution qhd+ with 360hz ideal for running complex data visualization algorithms extending from 1309 dollars to 2767 dollars.",intel core ultra 9 185 series,nvidia rtx a3000 ,16gb,display resolution qhd+,360hz,acer,extending from 1309 dollars to 2767 dollars
"ryzen ai 7 7th , nvidia geforce rtx 4090 plus 40gb together alongside 3k display panel & 144hz laptop brought to life by lenovo, optimized for equipped for running virtual machines execution? above 3083 USD.",ryzen ai 7 7th,nvidia geforce rtx 4090,40gb,3k display panel,144hz,lenovo,above 3083 USD
"Need to find a laptop . It is offered by razer, having amd ryzen 9 pro 6th together alongside nvidia geforce rtx 4080 as well ram 8gb along with 3k5 resolution besides 60hz designed for high-performance data mining just about $unknown.",amd ryzen 9 pro 6th,nvidia geforce rtx 4080,ram 8gb,3k5 resolution,60hz,razer,just about $unknown
"Let’s look at laptops . It is produced by xmg, equipped with intel core i7 13700hx accompanied by nvidia geforce rtx 3060 in addition to ram 16gb as well as display resolution wqxga & 144hz optimized for running advanced data analytics tools over 2913 dollars.",intel core i7 13700hx,nvidia geforce rtx 3060,ram 16gb,display resolution wqxga,144hz,xmg,over 2913 dollars
"Can you show me some laptops produced with care by lenovo, with core ultra 9 & nvidia rtx a3000 in addition to 128gb as well display panel 3200 x 2000 , 60hz perfect for 3D modeling and rendering Budget ceiling is set at $1881..",core ultra 9,nvidia rtx a3000,128gb,display panel 3200 x 2000,60hz,lenovo,Budget ceiling is set at $1881.
"Trying to find laptops designed exclusively by asus, having core i7 14 series alongside geforce rtx 4080 in addition to 8gb ram together alongside display panel 1080p together with 144hz use for training machine learning models in excess of $unknown.",core i7 14 series,geforce rtx 4080,8gb ram,display panel 1080p,144hz,asus,in excess of $unknown
"core i7 and nvidia geforce mx330 as well ram 24gb next to qhd+ display resolution alongside 250hz laptop made possible by xpg, efficient for capable of handling large-scale data analytics development? ranging from unknown to 2288.",core i7,nvidia geforce mx330,ram 24gb,qhd+ display resolution,250hz,xpg,ranging from unknown to 2288
"Recommendations for laptops developed in-house by lenovo, that feature amd ryzen ai 7 gen 8 as well nvidia geforce rtx 3050 along with ram 32gb alongside display panel 16-inch retina and 300hz capable of running deep learning models on the order of $unknown.",amd ryzen ai 7 gen 8,nvidia geforce rtx 3050,ram 32gb,display panel 16-inch retina,300hz,lenovo,on the order of $unknown
"I would like to see laptops produced with care by razer, that have intel core i5 14500hx not to mention nvidia rtx a3000 as well 32gb ram joined by 3072p display with 480hz suitable for software development and coding Budget ceiling is set at 2363 dollars..",intel core i5 14500hx,nvidia rtx a3000,32gb ram,3072p display,480hz,razer,Budget ceiling is set at 2363 dollars.
"Is there a laptop engineered by xmg, available that amd ryzen 9 7th , nvidia geforce rtx 2060 & 48gb ram joined by 3k2k (16:9) display resolution next to 300hz suitable for running high-performance data modeling software about 2849 USD.",amd ryzen 9 7th,nvidia geforce rtx 2060,48gb ram,3k2k (16:9) display resolution,300hz,xmg,about 2849 USD
"Help me find laptops curated by razer, with ryzen ai 9 5th together alongside nvidia geforce rtx 3080 accompanied by 128gb as well as display resolution 3840 x 2400 combined with 240hz ideal for running complex 3D simulations surpassing unknown USD.",ryzen ai 9 5th,nvidia geforce rtx 3080,128gb,display resolution 3840 x 2400,240hz,razer,surpassing unknown USD
"ryzen ai 7 as well as nvidia geforce rtx 2060 in addition to ram 12gb accompanied by screen resolution 3.5k ; 120hz laptop crafted by lg, efficient for ideal for running complex video editing software control? approximately $unknown.",ryzen ai 7,nvidia geforce rtx 2060,ram 12gb,screen resolution 3.5k,120hz,lg,approximately $unknown
"intel core i9 14900hx coupled with amd radeon rx 7700s as well 48gb ram as well as 3840 x 2160 resolution besides 300hz laptop . The brand behind this product is hp, tailored for capable of handling large-scale data visualization solutions? in the region of 1425.",intel core i9 14900hx,amd radeon rx 7700s,48gb ram,3840 x 2160 resolution,300hz,hp,in the region of 1425
"View laptops . It is produced by acer, with these features amd ryzen 7 7840hs as well gtx 1660 ti , ram 24gb alongside screen resolution qhd+ 16:9 together alongside 250hz optimized for running data visualization tools roughly 2540.",amd ryzen 7 7840hs,gtx 1660 ti,ram 24gb,screen resolution qhd+ 16:9,250hz,acer,roughly 2540
"intel core i9 14 series besides nvidia rtx 3000 ada & 12gb ram accompanied by quad extended (16:10) display resolution as well 300hz laptop . It is offered by lg, suitable for equipped for running virtual machines planning? I can spent about $unknown.",intel core i9 14 series,nvidia rtx 3000 ada,12gb ram,quad extended (16:10) display resolution,300hz,lg,I can spent about $unknown
"Interested in finding laptops . It is endorsed by xpg, that feature amd ryzen ai 7 gen 5 plus nvidia geforce rtx 2080 super max-q with ram 32gb as well as quad extended (16:10) resolution in addition to 120hz optimized for running advanced machine learning algorithms around 2419 dollars.",amd ryzen ai 7 gen 5,nvidia geforce rtx 2080 super max-q,ram 32gb,quad extended (16:10) resolution,120hz,xpg,around 2419 dollars
"amd ryzen 7 pro 6th combined with nvidia geforce rtx 3080 together alongside 40gb ram & display retina 15 coupled with 60hz laptop . It is produced by xpg, equipped to carry out optimized for running advanced data analytics tools? The expenditure limit is $unknown..",amd ryzen 7 pro 6th,nvidia geforce rtx 3080,40gb ram,display retina 15,60hz,xpg,The expenditure limit is $unknown.
"intel core i7 13700hx ; nvidia rtx 3060 as well 64gb plus ultra hd display resolution alongside 250hz laptop . This item comes courtesy of dell, designed to manage suitable for running high-end graphics applications? in the vicinity of 2292.",intel core i7 13700hx,nvidia rtx 3060,64gb,ultra hd display resolution,250hz,dell,in the vicinity of 2292
"intel core i5 11 series with geforce rtx 4090 as well 32gb ram coupled with full hd monitor resolution together alongside 120hz laptop presented by lenovo, efficient for designed for high-performance data modeling achievement? in excess of 1303 USD.",intel core i5 11 series,geforce rtx 4090,32gb ram,full hd monitor resolution,120hz,lenovo,in excess of 1303 USD
"amd ryzen 7 pro 7840hs and nvidia geforce rtx 3070 , 96gb as well as monitor resolution fhd joined by 144hz laptop assembled by asus, ideal for optimized for running advanced data modeling tools innovation? extending from 2760 to unknown.",amd ryzen 7 pro 7840hs,nvidia geforce rtx 3070,96gb,monitor resolution fhd,144hz,asus,extending from 2760 to unknown
"core ultra 9 185 series joined by rtx 3070 ti & 24gb ram and display panel 3840 x 2160 besides 120hz laptop . It is offered by razer, efficient for capable of running the latest AAA titles productivity? The maximum budget is $1482..",core ultra 9 185 series,rtx 3070 ti,24gb ram,display panel 3840 x 2160,120hz,razer,The maximum budget is $1482.
"Look for laptops . It is a asus product, with high performance and intel core i7 1360p plus nvidia rtx 2080 super max-q along with ram 16gb and screen resolution 3:2 display ; 60hz suitable for running advanced data analysis tools in the neighborhood of $1507.",intel core i7 1360p,nvidia rtx 2080 super max-q,ram 16gb,screen resolution 3:2 display,60hz,asus,in the neighborhood of $1507
"ryzen 5 with geforce rtx 4090 & 96gb not to mention monitor resolution 1080p alongside 300hz laptop . A xmg exclusive, powerful enough to run capable of handling high-resolution displays? The expenditure limit is unknown dollars..",ryzen 5,geforce rtx 4090,96gb,monitor resolution 1080p,300hz,xmg,The expenditure limit is unknown dollars.
"core i9 10th together alongside amd radeon rx 7600s not to mention 32gb ram and 3456 x 2160 screen resolution joined by 240hz laptop . It is manufactured by msi, designed for designed for high-speed data mining scenarios? fluctuating between unknown and 2823.",core i9 10th,amd radeon rx 7600s,32gb ram,3456 x 2160 screen resolution,240hz,msi,fluctuating between unknown and 2823
"core i9 and nvidia rtx a2000 as well ram 64gb accompanied by display resolution retina 16 ; 480hz laptop . It is designed by hp, designed for capable of handling large-scale data analytics? more than 3364 USD.",core i9,nvidia rtx a2000,ram 64gb,display resolution retina 16,480hz,hp,more than 3364 USD
"Recommendations for laptops . It comes from asus, that feature core i5 combined with rtx 4060 joined by 32gb ram coupled with display 2560 x 1440 together with 144hz ideal for running complex data visualization algorithms up to a maximum of unknown can be spent..",core i5,rtx 4060,32gb ram,display 2560 x 1440,144hz,asus,up to a maximum of unknown can be spent.
"recommend me some laptops . This item comes courtesy of lg, have ryzen 5 pro 5th as well as nvidia geforce rtx 3070 ti besides 16gb alongside 3456 x 2160 together alongside 120hz optimized for running advanced data modeling tools almost $unknown.",ryzen 5 pro 5th,nvidia geforce rtx 3070 ti,16gb,3456 x 2160,120hz,lg,almost $unknown
"ryzen 5 along with nvidia rtx 3000 ada accompanied by 16gb not to mention resolution 3072 x 1920 as well 60hz laptop brought to you by lg, ideal for optimized for running advanced data analytics tools innovation? over 3446 USD.",ryzen 5,nvidia rtx 3000 ada,16gb,resolution 3072 x 1920,60hz,lg,over 3446 USD
"amd ryzen 5 gen 4 in addition to nvidia geforce rtx 3070 besides 12gb ram , retina-like display panel alongside 90hz laptop . It is endorsed by hp, designed to foster designed for high-speed data transfer? around unknown dollars.",amd ryzen 5 gen 4,nvidia geforce rtx 3070,12gb ram,retina-like display panel,90hz,hp,around unknown dollars
"Assistance in finding laptops . This item is created by asus, equipped with intel core i7 13 series together with nvidia rtx a5500 as well 64gb ram not to mention display panel 2160p & 120hz capable of handling large-scale data analytics up to a maximum of 2055 dollars can be spent..",intel core i7 13 series,nvidia rtx a5500,64gb ram,display panel 2160p,120hz,asus,up to a maximum of 2055 dollars can be spent.
"core i9 gen 9 not to mention rx 6500m plus 48gb ram ; screen resolution wqhd as well as 240hz laptop . This item comes courtesy of lg, suitable for ideal for running complex data mining algorithms breakthroughs? up to a maximum of $2303 can be spent..",core i9 gen 9,rx 6500m,48gb ram,screen resolution wqhd,240hz,lg,up to a maximum of $2303 can be spent.
"Look for a laptop assembled by asus, that includes intel core i7 13th together with nvidia rtx a3000 plus 96gb coupled with 3200 x 2000 next to 360hz perfect for 3D modeling and rendering just under 2637 dollars.",intel core i7 13th,nvidia rtx a3000,96gb,3200 x 2000,360hz,asus,just under 2637 dollars
"Recommend some strong laptops crafted by xpg, with amd ryzen 7 7735hs together alongside nvidia rtx a5500 & 96gb ram together with screen resolution qxga+ besides 90hz designed for high-performance audio production almost $1416.",amd ryzen 7 7735hs,nvidia rtx a5500,96gb ram,screen resolution qxga+,90hz,xpg,almost $1416
"intel core i7 13700hx joined by nvidia rtx a5500 & 96gb ram plus screen resolution 3200 x 2000 alongside 165hz laptop engineered by lenovo, suitable for capable of handling large-scale data mining missions? beyond $unknown.",intel core i7 13700hx,nvidia rtx a5500,96gb ram,screen resolution 3200 x 2000,165hz,lenovo,beyond $unknown
"Please give me suggestions for laptops . It is designed by razer, with intel core ultra 7 185 series joined by nvidia t500 together with 32gb ram as well as 2880 x 1620 monitor resolution as well 120hz ideal for running complex data mining algorithms extending from 2118 dollars to unknown dollars.",intel core ultra 7 185 series,nvidia t500,32gb ram,2880 x 1620 monitor resolution,120hz,razer,extending from 2118 dollars to unknown dollars
"Can you show me some laptops . This item comes courtesy of hp, with core i9 11 series combined with nvidia geforce rtx 2080 super max-q & 24gb ; 2k display panel together with 165hz ideal for running complex 3D simulations a bit under 1604 USD.",core i9 11 series,nvidia geforce rtx 2080 super max-q,24gb,2k display panel,165hz,hp,a bit under 1604 USD
"Looking to find laptops . This product belongs to msi, with these features intel core i7 11th besides rx 6500m as well 12gb ram along with 3840 x 2160 together alongside 144hz suitable for running high-performance data analytics software from unknown USD to 3134 USD.",intel core i7 11th,rx 6500m,12gb ram,3840 x 2160,144hz,msi,from unknown USD to 3134 USD
"Which laptops developed in-house by xpg, should I consider with intel core i7 13650hx besides nvidia rtx a3000 accompanied by 16gb in addition to 2560 x 1600 display resolution ; 165hz sufficient for gaming in the ballpark of 1833 USD.",intel core i7 13650hx,nvidia rtx a3000,16gb,2560 x 1600 display resolution,165hz,xpg,in the ballpark of 1833 USD
"I am looking for laptops crafted by razer, with excellent performance amd ryzen 7 gen 7 accompanied by nvidia rtx a3000 combined with 128gb in addition to 2880 x 1620 joined by 60hz capable of handling large-scale data analytics and I can spent under $1921.",amd ryzen 7 gen 7,nvidia rtx a3000,128gb,2880 x 1620,60hz,razer,and I can spent under $1921
"core ultra 7 accompanied by nvidia rtx 2050 , ram 24gb besides display panel 2160p joined by 360hz laptop crafted by dell, designed to govern suitable for software development and coding? over $3286.",core ultra 7,nvidia rtx 2050,ram 24gb,display panel 2160p,360hz,dell,over $3286
"core i9 next to rtx 4070 coupled with 96gb ram , qhd+ (16:10) display resolution plus 300hz laptop . It is manufactured by lenovo, efficient for optimized for running big data applications productivity? at least 3361 USD.",core i9,rtx 4070,96gb ram,qhd+ (16:10) display resolution,300hz,lenovo,at least 3361 USD
"Do you have laptops . It is endorsed by lenovo, with amd ryzen 7 5800h in addition to rtx 4070 together with 64gb & display panel 1920 x 1200 along with 144hz designed for high-speed data modeling My budget cap is 2976..",amd ryzen 7 5800h,rtx 4070,64gb,display panel 1920 x 1200,144hz,lenovo,My budget cap is 2976.
"The laptop made possible by msi, needs to have amd ryzen 7 7840hs joined by rtx 3050 as well as 16gb along with screen resolution fhd and 60hz optimized for running advanced data mining tools more or less 2919 USD.",amd ryzen 7 7840hs,rtx 3050,16gb,screen resolution fhd,60hz,msi,more or less 2919 USD
"Excited about laptops brought to you by microsoft, having amd ryzen ai 7 6th coupled with nvidia t500 , 32gb joined by monitor resolution retina 15 accompanied by 90hz designed for high-performance just about unknown.",amd ryzen ai 7 6th,nvidia t500,32gb,monitor resolution retina 15,90hz,microsoft,just about unknown
"Look for a laptop . It is produced by lenovo, that includes core i7 as well as nvidia geforce rtx 3070 ti not to mention 48gb coupled with 2880 x 1800 display resolution joined by 480hz designed for high-speed data analysis and I can spent under 1833 dollars.",core i7,nvidia geforce rtx 3070 ti,48gb,2880 x 1800 display resolution,480hz,lenovo,and I can spent under 1833 dollars
"Excited about laptops designed exclusively by asus, having ryzen 5 coupled with nvidia geforce rtx 3050 combined with 12gb joined by wuxga screen resolution , 60hz suitable for running high-performance data analytics software in the range of $unknown to $1995.",ryzen 5,nvidia geforce rtx 3050,12gb,wuxga screen resolution,60hz,asus,in the range of $unknown to $1995
"I am looking for laptops . It is endorsed by gigabyte, with excellent performance core i7 gen 14 besides geforce gtx 1650 & 96gb as well as triple hd display resolution ; 165hz optimized for running resource-intensive applications more or less unknown.",core i7 gen 14,geforce gtx 1650,96gb,triple hd display resolution,165hz,gigabyte,more or less unknown
"Powerful laptops . It is manufactured by gigabyte, equipped with ryzen 9 pro plus nvidia rtx 3060 together alongside ram 40gb with 2560 x 1600 as well as 300hz capable of handling large-scale data mining between 1615 and 2935.",ryzen 9 pro,nvidia rtx 3060,ram 40gb,2560 x 1600,300hz,gigabyte,between 1615 and 2935
"amd ryzen 7 4800h accompanied by amd radeon rx 7600s as well ram 48gb next to monitor resolution 2880 x 1620 along with 240hz laptop . The brand behind this product is samsung, efficient for can handle machine learning workloads regulation? in the region of 2643 USD.",amd ryzen 7 4800h,amd radeon rx 7600s,ram 48gb,monitor resolution 2880 x 1620,240hz,samsung,in the region of 2643 USD
"Looking for laptops brought to life by razer, equipped with intel core i5 gen 12 accompanied by nvidia rtx a2000 together alongside ram 40gb plus 1920 x 1080 alongside 165hz designed for high-speed data analysis The expenditure limit is 3002 dollars..",intel core i5 gen 12,nvidia rtx a2000,ram 40gb,1920 x 1080,165hz,razer,The expenditure limit is 3002 dollars.
"amd ryzen 7 7th next to nvidia geforce rtx 3060 together alongside 48gb and 2560 x 1440 , 144hz laptop presented by xmg, powerful enough for ideal for streaming and content creation? more than unknown.",amd ryzen 7 7th,nvidia geforce rtx 3060,48gb,2560 x 1440,144hz,xmg,more than unknown
"Trying to find laptops developed in-house by razer, having amd ryzen 7 7745hx next to geforce rtx 2080 super max-q joined by 8gb ram besides qhd+ monitor resolution plus 60hz optimized for running advanced data modeling tools roughly 3181 USD.",amd ryzen 7 7745hx,geforce rtx 2080 super max-q,8gb ram,qhd+ monitor resolution,60hz,razer,roughly 3181 USD
"Powerful laptops . An innovation from xmg, equipped with core ultra 7 155 series alongside rtx 3050 ti joined by 16gb together alongside 1920 x 1080 display resolution along with 60hz suitable for running high-performance data mining software at least 2028 USD.",core ultra 7 155 series,rtx 3050 ti,16gb,1920 x 1080 display resolution,60hz,xmg,at least 2028 USD
"amd ryzen 7 4800h along with rx 6500m as well ram 16gb , monitor resolution fhd & 90hz laptop brought to life by samsung, powerful enough to direct optimized for running advanced data modeling tools? slightly below $unknown.",amd ryzen 7 4800h,rx 6500m,ram 16gb,monitor resolution fhd,90hz,samsung,slightly below $unknown
"The laptop . It is endorsed by dell, needs to have core ultra 9 & nvidia geforce rtx 3080 combined with 48gb along with qhd resolution ; 144hz ideal for running advanced engineering applications between $1550 and $unknown.",core ultra 9,nvidia geforce rtx 3080,48gb,qhd resolution,144hz,dell,between $1550 and $unknown
"What types of laptops . It is endorsed by xmg, should I look at that include intel core i9 10980hk besides nvidia geforce rtx 3080 and 16gb , display panel wqxga with 480hz suitable for running high-performance data mining software more or less 1444 dollars.",intel core i9 10980hk,nvidia geforce rtx 3080,16gb,display panel wqxga,480hz,xmg,more or less 1444 dollars
"Recommend some strong laptops . It is designed by asus, with core i7 gen 14 besides rtx 3080 along with 24gb not to mention display panel wide quad ultra extended with 120hz ideal for running complex data mining algorithms in the region of 1784.",core i7 gen 14,rtx 3080,24gb,display panel wide quad ultra extended,120hz,asus,in the region of 1784
"ryzen ai 9 6th joined by geforce mx330 next to 12gb together with 2400 x 1600 as well as 120hz laptop brought to life by razer, tailored for suitable for running high-performance data modeling software coordination? in the ballpark of 1742 USD.",ryzen ai 9 6th,geforce mx330,12gb,2400 x 1600,120hz,razer,in the ballpark of 1742 USD
"Can you show me laptops brought to life by hp, that include ryzen 9 8th next to amd radeon rx 6500m joined by 32gb ram combined with qhd+ (16:10) display coupled with 144hz optimized for running advanced data mining tools circa $1890.",ryzen 9 8th,amd radeon rx 6500m,32gb ram,qhd+ (16:10) display,144hz,hp,circa $1890
"In need of help finding laptops produced with care by acer, having core ultra 7 185 series with nvidia rtx a500 coupled with 40gb ram besides 1920 x 1200 display resolution as well 300hz ideal for running complex 3D simulations The expenditure limit is 3218 dollars..",core ultra 7 185 series,nvidia rtx a500,40gb ram,1920 x 1200 display resolution,300hz,acer,The expenditure limit is 3218 dollars.
"I am in the market for a laptop created by the team at acer, including amd ryzen 9 5900hs with nvidia t500 together with ram 64gb & 2880 x 1800 as well as 90hz use for data analysis tasks a bit under 1701.",amd ryzen 9 5900hs,nvidia t500,ram 64gb,2880 x 1800,90hz,acer,a bit under 1701
"intel core i5 9th next to nvidia geforce rtx 4090 along with 16gb together alongside 3072 x 1920 as well 165hz laptop . It is produced by razer, efficient for suitable for running high-performance data analytics software regulation? greater than 2638 dollars.",intel core i5 9th,nvidia geforce rtx 4090,16gb,3072 x 1920,165hz,razer,greater than 2638 dollars
"core i7 not to mention nvidia geforce rtx 2070 as well ram 128gb next to display panel wuxga , 360hz laptop brought to life by hp, perfect for optimized for running advanced data mining tools operation? Maximum spending limit: 3336 dollars..",core i7,nvidia geforce rtx 2070,ram 128gb,display panel wuxga,360hz,hp,Maximum spending limit: 3336 dollars.
"Can you show me laptops . This item comes courtesy of xmg, that include intel core ultra 7 155 series alongside nvidia rtx 2080 super max-q plus ram 8gb joined by 3k2k (16:9) monitor resolution next to 60hz ideal for content creation and multimedia editing close to 2347 USD.",intel core ultra 7 155 series,nvidia rtx 2080 super max-q,ram 8gb,3k2k (16:9) monitor resolution,60hz,xmg,close to 2347 USD
"core i7 11 series accompanied by rtx 4060 combined with 128gb coupled with 3.5k monitor resolution and 300hz laptop assembled by hp, ideal for optimized for running advanced data analytics tools success? around $2473.",core i7 11 series,rtx 4060,128gb,3.5k monitor resolution,300hz,hp,around $2473
"What are your suggestions for laptops presented by acer, featuring: core i5 as well as rx 7700s next to ram 40gb ; display 3:2 display with 480hz suitable for running statistical analysis software not exceeding 3479 USD.",core i5,rx 7700s,ram 40gb,display 3:2 display,480hz,acer,not exceeding 3479 USD
"core ultra 9 along with nvidia geforce rtx 2080 super max-q , 32gb as well retina-like screen resolution not to mention 120hz laptop . It is a razer product, suitable for suitable for running high-performance data analytics software planning? greater than $2775.",core ultra 9,nvidia geforce rtx 2080 super max-q,32gb,retina-like screen resolution,120hz,razer,greater than $2775
"What are your top picks for laptops . It is designed by acer, having core i5 joined by geforce mx330 not to mention 32gb plus display panel full hd with 250hz capable of handling large-scale data mining more than unknown.",core i5,geforce mx330,32gb,display panel full hd,250hz,acer,more than unknown
"amd ryzen 5 7640hs , rx 6500m & 12gb joined by screen resolution 16:10 hd+ as well 360hz laptop designed exclusively by gigabyte, capable of delivering suitable for running statistical analysis software results? approximately unknown.",amd ryzen 5 7640hs,rx 6500m,12gb,screen resolution 16:10 hd+,360hz,gigabyte,approximately unknown
"amd ryzen ai 9 hx 370 coupled with nvidia geforce rtx 4070 together with ram 48gb in addition to display 3840 x 2400 ; 144hz laptop presented by xpg, suitable for ideal for running machine learning frameworks missions? more or less 1944 dollars.",amd ryzen ai 9 hx 370,nvidia geforce rtx 4070,ram 48gb,display 3840 x 2400,144hz,xpg,more or less 1944 dollars
"amd ryzen ai 7 6th ; amd radeon rx 7600s in addition to 12gb alongside display resolution 16-inch retina with 120hz laptop engineered by lenovo, efficient for suitable for running high-performance data analytics software development? at least 3487.",amd ryzen ai 7 6th,amd radeon rx 7600s,12gb,display resolution 16-inch retina,120hz,lenovo,at least 3487
"Any laptops designed exclusively by razer, on your list that include amd ryzen ai 9 hx 370 together with nvidia geforce rtx 4070 combined with 16gb ram joined by display resolution full hd besides 250hz designed for high-performance scientific research a bit under 3472.",amd ryzen ai 9 hx 370,nvidia geforce rtx 4070,16gb ram,display resolution full hd,250hz,razer,a bit under 3472
"intel core i7 9th together with nvidia rtx 2000 ada as well as 40gb joined by 3840 x 2400 display with 165hz laptop brought to life by xpg, suitable for designed for high-performance audio production duty? around 3078 dollars.",intel core i7 9th,nvidia rtx 2000 ada,40gb,3840 x 2400 display,165hz,xpg,around 3078 dollars
"ryzen 7 pro together with nvidia rtx 4060 & 8gb and full hd monitor resolution next to 165hz laptop . It is offered by samsung, efficient for capable of handling advanced photo editing tasks efficiency? The maximum amount I can spend is unknown..",ryzen 7 pro,nvidia rtx 4060,8gb,full hd monitor resolution,165hz,samsung,The maximum amount I can spend is unknown.
