question,cpu,gpu,ram,display,refresh rate,brand,price
"core i5 and nvidia rtx a5000 coupled with 48gb together with retina 16 display in addition to 300hz laptop assembled by asus, suitable for optimized for running advanced gaming graphics administration? not exceeding 3069 USD.",core i5,nvidia rtx a5000,48gb,retina 16 display,300hz,asus,not exceeding 3069 USD
"What are your top picks for laptops . This item is created by hp, having core i9 as well as nvidia rtx 3070 and 64gb ram , display panel 3200 x 2000 ; 90hz designed for high-performance data modeling My budget cap is 2225 USD..",core i9,nvidia rtx 3070,64gb ram,display panel 3200 x 2000,90hz,hp,My budget cap is 2225 USD.
"Need a laptop . It is offered by hp, with core i7 14 series & gtx 1660 ti with ram 64gb together with display wqhd in addition to 480hz suitable for running advanced data analysis tools greater than unknown USD.",core i7 14 series,gtx 1660 ti,ram 64gb,display wqhd,480hz,hp,greater than unknown USD
"core ultra 9 & nvidia rtx a1000 with 32gb ram together with 1920 x 1080 besides 165hz laptop . It is developed by msi, designed to manage ideal for running complex data visualization algorithms? in the ballpark of 2138.",core ultra 9,nvidia rtx a1000,32gb ram,1920 x 1080,165hz,msi,in the ballpark of 2138
"intel core i9 14900hx together alongside nvidia rtx 3000 ada not to mention 40gb besides 1920 x 1080 display resolution , 144hz laptop crafted by hp, designed to manage designed for high-performance data modeling? My budget cap is $unknown..",intel core i9 14900hx,nvidia rtx 3000 ada,40gb,1920 x 1080 display resolution,144hz,hp,My budget cap is $unknown.
"I need a laptop . It comes from msi, equipped with ryzen ai 9 , geforce rtx 2060 and ram 40gb & resolution 1920 x 1200 together with 480hz ideal for running complex data mining algorithms The maximum allowable budget is 3206 dollars..",ryzen ai 9,geforce rtx 2060,ram 40gb,resolution 1920 x 1200,480hz,msi,The maximum allowable budget is 3206 dollars.
"ryzen 7 coupled with nvidia geforce rtx 4080 , 48gb in addition to display panel 1920 x 1200 plus 360hz laptop . This product belongs to razer, perfect for ideal for streaming and content creation operation? over unknown USD.",ryzen 7,nvidia geforce rtx 4080,48gb,display panel 1920 x 1200,360hz,razer,over unknown USD
"amd ryzen ai 9 5th joined by amd radeon rx 6500m as well ram 24gb ; display panel full hd with 300hz laptop . It is developed by dell, equipped to handle designed for high-speed data mining? just under 1878.",amd ryzen ai 9 5th,amd radeon rx 6500m,ram 24gb,display panel full hd,300hz,dell,just under 1878
"Show me some laptops produced with care by acer, that have amd ryzen 7 pro 6850h as well as nvidia rtx 4080 combined with 40gb ram , display resolution retina-like in addition to 360hz optimized for running advanced data analytics tools nearly 1911 USD.",amd ryzen 7 pro 6850h,nvidia rtx 4080,40gb ram,display resolution retina-like,360hz,acer,nearly 1911 USD
"intel core i7 11 series & nvidia rtx 4090 as well ram 12gb joined by display wide quad ultra extended combined with 300hz laptop brought to life by samsung, equipped to carry out suitable for running high-performance data mining software? up to a maximum of unknown dollars can be spent..",intel core i7 11 series,nvidia rtx 4090,ram 12gb,display wide quad ultra extended,300hz,samsung,up to a maximum of unknown dollars can be spent.
"Thinking of looking for laptops . It is produced by gigabyte, that have amd ryzen 5 8th next to rtx 3050 and 24gb ram along with display 3840 x 2400 accompanied by 60hz ideal for running complex data visualization algorithms about 2246 USD.",amd ryzen 5 8th,rtx 3050,24gb ram,display 3840 x 2400,60hz,gigabyte,about 2246 USD
"Looking to find laptops . It is designed by xpg, with these features core ultra 7 as well nvidia rtx a5500 ; 12gb ram next to resolution qhd+ 16:9 & 250hz capable of handling large-scale data analysis from unknown dollars to 3266 dollars.",core ultra 7,nvidia rtx a5500,12gb ram,resolution qhd+ 16:9,250hz,xpg,from unknown dollars to 3266 dollars
"core i5 accompanied by nvidia geforce rtx 2080 super max-q coupled with 40gb and wqxga+ (16:10) display resolution besides 240hz laptop produced with care by xmg, tailored for capable of handling large-scale data mining project? slightly below unknown.",core i5,nvidia geforce rtx 2080 super max-q,40gb,wqxga+ (16:10) display resolution,240hz,xmg,slightly below unknown
"Seeking out laptops curated by xmg, that come with amd ryzen 7 pro 7840hs , nvidia geforce rtx 3050 alongside 12gb together with display resolution 1920 x 1080 coupled with 360hz capable of running AAA games Maximum spending limit: unknown..",amd ryzen 7 pro 7840hs,nvidia geforce rtx 3050,12gb,display resolution 1920 x 1080,360hz,xmg,Maximum spending limit: unknown.
"amd ryzen ai 7 8th accompanied by nvidia rtx a2000 joined by 40gb ram alongside 3.5k display panel not to mention 480hz laptop . This product belongs to gigabyte, suitable for use for data analysis tasks? exceeding $unknown.",amd ryzen ai 7 8th,nvidia rtx a2000,40gb ram,3.5k display panel,480hz,gigabyte,exceeding $unknown
"intel core i7 13800h together alongside nvidia rtx a5500 besides ram 32gb not to mention wquxga display resolution in addition to 60hz laptop . It is offered by dell, designed to handle suitable for running high-performance data mining software? spanning from 1695 USD to 2287 USD.",intel core i7 13800h,nvidia rtx a5500,ram 32gb,wquxga display resolution,60hz,dell,spanning from 1695 USD to 2287 USD
"ryzen 7 pro as well as geforce rtx 2080 super max-q joined by 40gb next to monitor resolution 16:10 4k+ , 480hz laptop . This product belongs to acer, designed to govern designed for high-performance data visualization? slightly below 2498.",ryzen 7 pro,geforce rtx 2080 super max-q,40gb,monitor resolution 16:10 4k+,480hz,acer,slightly below 2498
"amd ryzen 7 6th with geforce rtx 3080 as well 64gb ram accompanied by display resolution 1080p ; 120hz laptop produced with care by lenovo, capable of delivering optimized for running advanced data modeling tools results? spanning from unknown dollars to 3301 dollars.",amd ryzen 7 6th,geforce rtx 3080,64gb ram,display resolution 1080p,120hz,lenovo,spanning from unknown dollars to 3301 dollars
"core i5 coupled with nvidia geforce rtx 3080 combined with 12gb ram along with 3840 x 2400 monitor resolution plus 165hz laptop brought to you by asus, designed for suitable for running statistical analysis software ? in the neighborhood of $unknown.",core i5,nvidia geforce rtx 3080,12gb ram,3840 x 2400 monitor resolution,165hz,asus,in the neighborhood of $unknown
"intel core ultra 9 155 series joined by geforce rtx 2050 as well 32gb not to mention 3456 x 2160 display panel accompanied by 300hz laptop . It is designed by asus, designed to handle suitable for running high-performance data mining software? in the vicinity of $1320.",intel core ultra 9 155 series,geforce rtx 2050,32gb,3456 x 2160 display panel,300hz,asus,in the vicinity of $1320
"Can you propose laptops curated by razer, with ryzen ai 5 8th alongside nvidia geforce rtx 2050 combined with 48gb besides display resolution retina 15 with 250hz designed for high-performance data mining The maximum budget is 2448 USD..",ryzen ai 5 8th,nvidia geforce rtx 2050,48gb,display resolution retina 15,250hz,razer,The maximum budget is 2448 USD.
"ryzen 5 pro coupled with nvidia rtx a5500 accompanied by 16gb ram ; monitor resolution 3:2 display together with 60hz laptop . An innovation from samsung, optimized for optimized for running cloud-based applications efficiency? almost 1976.",ryzen 5 pro,nvidia rtx a5500,16gb ram,monitor resolution 3:2 display,60hz,samsung,almost 1976
"Show me laptops . It is offered by microsoft, featuring these specifications intel core i7 13800h as well nvidia geforce rtx 2070 accompanied by 32gb ram with display resolution 3k2k (16:9) coupled with 144hz designed for high-performance gaming exceeding $1802.",intel core i7 13800h,nvidia geforce rtx 2070,32gb ram,display resolution 3k2k (16:9),144hz,microsoft,exceeding $1802
"Would you mind suggesting laptops developed in-house by lg, that come with intel core i7 11th together alongside rtx a3000 , 64gb joined by display resolution uhd as well 300hz optimized for running advanced data analytics tools The maximum budget is $3371..",intel core i7 11th,rtx a3000,64gb,display resolution uhd,300hz,lg,The maximum budget is $3371.
"ryzen ai 9 with nvidia rtx 3050 combined with ram 32gb ; resolution uhd in addition to 144hz laptop . It is designed by xpg, efficient for designed for high-performance productivity? in the range of unknown USD to 3193 USD.",ryzen ai 9,nvidia rtx 3050,ram 32gb,resolution uhd,144hz,xpg,in the range of unknown USD to 3193 USD
"ryzen ai 9 plus nvidia geforce rtx 3070 ti in addition to ram 12gb next to 3456 x 2160 with 60hz laptop engineered by msi, designed to govern suitable for running high-performance data modeling software? I am limited to a maximum budget of 3332 USD..",ryzen ai 9,nvidia geforce rtx 3070 ti,ram 12gb,3456 x 2160,60hz,msi,I am limited to a maximum budget of 3332 USD.
"core i9 13th and nvidia rtx 2070 ; ram 8gb & 3456 x 2160 screen resolution together with 480hz laptop . It is designed by hp, powerful enough to ensure suitable for running high-performance data modeling software? fluctuating between 1886 USD and 2188 USD.",core i9 13th,nvidia rtx 2070,ram 8gb,3456 x 2160 screen resolution,480hz,hp,fluctuating between 1886 USD and 2188 USD
"amd ryzen 5 5th not to mention nvidia rtx a3000 together alongside ram 12gb , 4k monitor resolution alongside 240hz laptop . An innovation from hp, powerful enough to run designed for high-performance computing tasks? around $1708.",amd ryzen 5 5th,nvidia rtx a3000,ram 12gb,4k monitor resolution,240hz,hp,around $1708
"Looking to find laptops made possible by lg, with these features amd ryzen 9 8945hs not to mention nvidia geforce rtx 3070 accompanied by 64gb together alongside 1080p display alongside 60hz suitable for running enterprise-level software circa unknown USD.",amd ryzen 9 8945hs,nvidia geforce rtx 3070,64gb,1080p display,60hz,lg,circa unknown USD
"I am interested in laptops . A razer exclusive, that come with amd ryzen 5 5th together with nvidia geforce gtx 1660 ti besides 32gb alongside resolution 1080p accompanied by 144hz ideal for running complex financial models up to a maximum of 2106 can be spent..",amd ryzen 5 5th,nvidia geforce gtx 1660 ti,32gb,resolution 1080p,144hz,razer,up to a maximum of 2106 can be spent.
"Are there any laptops presented by hp, available featuring ryzen 7 together alongside nvidia rtx 3080 ti joined by 8gb ram not to mention qhd+ monitor resolution along with 300hz capable of handling large-scale data mining almost 2055.",ryzen 7,nvidia rtx 3080 ti,8gb ram,qhd+ monitor resolution,300hz,hp,almost 2055
"Display laptops engineered by hp, equipped with core ultra 7 and radeon rx 7600s combined with 24gb as well triple hd resolution ; 360hz optimized for running advanced data mining tools spanning from $2821 to $unknown.",core ultra 7,radeon rx 7600s,24gb,triple hd resolution,360hz,hp,spanning from $2821 to $unknown
"core i5 13 series ; nvidia geforce rtx 4050 along with ram 12gb accompanied by display panel 2880 x 1800 together alongside 144hz laptop . It is developed by msi, equipped for optimized for running advanced data mining tools challenges? nearly 2722 dollars.",core i5 13 series,nvidia geforce rtx 4050,ram 12gb,display panel 2880 x 1800,144hz,msi,nearly 2722 dollars
"Look for laptops . A msi exclusive, with high performance and core ultra 7 joined by nvidia gtx 1650 , 8gb ram ; 3840 x 2160 display together with 165hz designed for high-performance data modeling over 1504 USD.",core ultra 7,nvidia gtx 1650,8gb ram,3840 x 2160 display,165hz,msi,over 1504 USD
"ryzen 9 gen 6 coupled with nvidia rtx a500 accompanied by 24gb ; 3:2 display display resolution combined with 165hz laptop . It is a microsoft product, suitable for designed for high-performance data mining attainment? between 2745 and 1890.",ryzen 9 gen 6,nvidia rtx a500,24gb,3:2 display display resolution,165hz,microsoft,between 2745 and 1890
"What are your top picks for laptops . It is developed by samsung, having ryzen 9 pro 6th and nvidia rtx a1000 , ram 96gb coupled with screen resolution 2160p ; 360hz suitable for running advanced data analysis tools in the range of unknown to 2677.",ryzen 9 pro 6th,nvidia rtx a1000,ram 96gb,screen resolution 2160p,360hz,samsung,in the range of unknown to 2677
"Would you mind suggesting laptops . It is produced by microsoft, that come with ryzen ai 7 gen 7 , nvidia geforce rtx 3070 along with 12gb ; 2560 x 1600 screen resolution coupled with 144hz designed for high-fidelity audio and video editing greater than unknown dollars.",ryzen ai 7 gen 7,nvidia geforce rtx 3070,12gb,2560 x 1600 screen resolution,144hz,microsoft,greater than unknown dollars
"Seek out powerful laptops assembled by gigabyte, equipped with ryzen ai 5 in addition to nvidia geforce rtx 3050 next to ram 48gb accompanied by screen resolution wqxga+ (16:10) joined by 250hz ideal for video editing and graphic design in the ballpark of $2680.",ryzen ai 5,nvidia geforce rtx 3050,ram 48gb,screen resolution wqxga+ (16:10),250hz,gigabyte,in the ballpark of $2680
"core ultra 9 alongside amd radeon rx 7600s accompanied by 24gb ram in addition to display resolution 16:10 4k+ besides 144hz laptop . It is a acer product, efficient for ideal for running complex data mining algorithms productivity? above 1308 dollars.",core ultra 9,amd radeon rx 7600s,24gb ram,display resolution 16:10 4k+,144hz,acer,above 1308 dollars
"Please suggest some laptops . It is offered by msi, having amd ryzen ai 7 5th together alongside nvidia rtx a500 next to 64gb ram ; monitor resolution quad extended (16:10) along with 144hz optimized for running advanced data analytics tools in the ballpark of unknown dollars.",amd ryzen ai 7 5th,nvidia rtx a500,64gb ram,monitor resolution quad extended (16:10),144hz,msi,in the ballpark of unknown dollars
"amd ryzen ai 9 5th not to mention nvidia rtx 3070 ti as well as 8gb ram besides 3456 x 2160 plus 120hz laptop . It is designed by asus, tailored for capable of handling large-scale data visualization solutions? exceeding 2943 dollars.",amd ryzen ai 9 5th,nvidia rtx 3070 ti,8gb ram,3456 x 2160,120hz,asus,exceeding 2943 dollars
"Do you have laptops produced with care by lenovo, available with ryzen 5 pro ; nvidia geforce rtx 3070 ti combined with ram 48gb plus 1920 x 1200 monitor resolution besides 480hz ideal for running complex data visualization algorithms covering $2252 to $unknown.",ryzen 5 pro,nvidia geforce rtx 3070 ti,ram 48gb,1920 x 1200 monitor resolution,480hz,lenovo,covering $2252 to $unknown
"amd ryzen 7 pro 6850h in addition to rtx a5000 plus ram 48gb alongside qhd+ 16:9 display panel accompanied by 60hz laptop brought to you by razer, tailored for capable of handling advanced photo editing tasks advancement? within the interval of 3462 to 3129.",amd ryzen 7 pro 6850h,rtx a5000,ram 48gb,qhd+ 16:9 display panel,60hz,razer,within the interval of 3462 to 3129
"core i5 13th , nvidia geforce rtx 2060 as well ram 48gb ; triple hd display resolution combined with 240hz laptop . An innovation from gigabyte, suitable for suitable for running high-performance data modeling software applications? not exceeding 2453 USD.",core i5 13th,nvidia geforce rtx 2060,ram 48gb,triple hd display resolution,240hz,gigabyte,not exceeding 2453 USD
"Looking to find laptops . It is produced by hp, with these features intel core i7 1355u combined with nvidia geforce rtx 3060 coupled with 24gb next to display 4k and 60hz capable of handling large-scale data analytics not exceeding a budget of $1383..",intel core i7 1355u,nvidia geforce rtx 3060,24gb,display 4k,60hz,hp,not exceeding a budget of $1383.
"Strong laptops . It is manufactured by asus, with high specs amd ryzen ai 5 gen 4 plus geforce rtx 4050 accompanied by 12gb next to display quad hd not to mention 144hz suitable for running complex simulations spanning from $1448 to $3361.",amd ryzen ai 5 gen 4,geforce rtx 4050,12gb,display quad hd,144hz,asus,spanning from $1448 to $3361
"ryzen ai 5 8th ; nvidia rtx 3080 next to ram 32gb besides 2880 x 1620 display panel and 165hz laptop assembled by acer, perfect for suitable for running high-end graphics applications operation? The maximum allowable budget is 2213 USD..",ryzen ai 5 8th,nvidia rtx 3080,ram 32gb,2880 x 1620 display panel,165hz,acer,The maximum allowable budget is 2213 USD.
"give me some recommendations for laptops . The brand behind this product is razer, with ryzen 5 gen 5 coupled with nvidia geforce rtx 4070 together with 40gb ; screen resolution 3k2k , 360hz designed for high-speed data processing almost 2168 dollars.",ryzen 5 gen 5,nvidia geforce rtx 4070,40gb,screen resolution 3k2k,360hz,razer,almost 2168 dollars
"amd ryzen ai 7 6th besides nvidia rtx a3000 accompanied by ram 12gb with retina 15 screen resolution ; 360hz laptop . It is manufactured by lg, designed for designed for high-performance scientific research ? around 1384.",amd ryzen ai 7 6th,nvidia rtx a3000,ram 12gb,retina 15 screen resolution,360hz,lg,around 1384
"amd ryzen 7 8845hs with nvidia rtx a3000 in addition to 24gb ram , display resolution retina 15 besides 480hz laptop curated by microsoft, tailored for designed for high-speed data mining advancement? in the region of $1712.",amd ryzen 7 8845hs,nvidia rtx a3000,24gb ram,display resolution retina 15,480hz,microsoft,in the region of $1712
"ryzen 9 gen 8 ; nvidia rtx 3070 ti plus 16gb ram combined with monitor resolution uhd , 240hz laptop . It is endorsed by dell, suitable for capable of handling large-scale data analytics duty? Maximum spending limit: 2719..",ryzen 9 gen 8,nvidia rtx 3070 ti,16gb ram,monitor resolution uhd,240hz,dell,Maximum spending limit: 2719.
"I am looking for laptops . It is produced by msi, equipped with intel core i7 13800h & amd radeon rx 7600s together alongside ram 64gb along with monitor resolution 3072 x 1920 besides 144hz ideal for running complex data analytics algorithms I am limited to a maximum budget of 2400..",intel core i7 13800h,amd radeon rx 7600s,ram 64gb,monitor resolution 3072 x 1920,144hz,msi,I am limited to a maximum budget of 2400.
"Trying to find laptops . This item comes courtesy of xpg, having core i9 gen 13 ; geforce rtx 3080 together alongside 48gb plus display fhd next to 240hz designed for high-speed data modeling in the vicinity of 3139 dollars.",core i9 gen 13,geforce rtx 3080,48gb,display fhd,240hz,xpg,in the vicinity of 3139 dollars
"Looking for laptops . This product belongs to lenovo, that have core i5 gen 12 and nvidia rtx a500 plus 48gb ram next to display resolution wquxga as well 120hz capable of handling intensive computational tasks a little less than 3249 USD.",core i5 gen 12,nvidia rtx a500,48gb ram,display resolution wquxga,120hz,lenovo,a little less than 3249 USD
"ryzen 5 ; nvidia t500 alongside 8gb ram next to display panel ultra hd accompanied by 144hz laptop . A xmg exclusive, equipped to handle designed for high-performance data mining assignment? nearly $unknown.",ryzen 5,nvidia t500,8gb ram,display panel ultra hd,144hz,xmg,nearly $unknown
"amd ryzen 9 4th , geforce mx330 besides 8gb ram accompanied by qhd+ (16:10) resolution together with 120hz laptop . It is offered by msi, optimized for designed for high-speed data visualization success? I am limited to a maximum budget of 2299..",amd ryzen 9 4th,geforce mx330,8gb ram,qhd+ (16:10) resolution,120hz,msi,I am limited to a maximum budget of 2299.
"intel core i7 14th next to nvidia geforce rtx 4080 ; 64gb ram together with 3200 x 2000 combined with 300hz laptop brought to you by gigabyte, perfect for designed for high-performance scientific computing? not exceeding a budget of unknown USD..",intel core i7 14th,nvidia geforce rtx 4080,64gb ram,3200 x 2000,300hz,gigabyte,not exceeding a budget of unknown USD.
"Display laptops . It is offered by asus, equipped with core ultra 9 as well geforce rtx 3050 ti in addition to 128gb coupled with 3,5k monitor resolution together with 120hz optimized for running advanced data mining tools extending from 3065 to unknown.",core ultra 9,geforce rtx 3050 ti,128gb,"3,5k monitor resolution",120hz,asus,extending from 3065 to unknown
"amd ryzen 5 8th in addition to nvidia geforce mx330 and 128gb , display panel qhd joined by 360hz laptop . It is designed by hp, optimized for designed for high-performance data visualization execution? within the interval of 2252 to 1330.",amd ryzen 5 8th,nvidia geforce mx330,128gb,display panel qhd,360hz,hp,within the interval of 2252 to 1330
"ryzen 9 gen 5 plus nvidia geforce rtx 3070 ti , 12gb besides 3072 x 1920 not to mention 144hz laptop . It is produced by xpg, equipped for ideal for running machine learning frameworks challenges? I am limited to a maximum budget of 3409 dollars..",ryzen 9 gen 5,nvidia geforce rtx 3070 ti,12gb,3072 x 1920,144hz,xpg,I am limited to a maximum budget of 3409 dollars.
"Looking for laptops . An innovation from dell, equipped with ryzen 9 pro together with nvidia rtx a3000 coupled with ram 16gb as well as monitor resolution 2560 x 1440 together alongside 60hz capable of handling large-scale data modeling over $3224.",ryzen 9 pro,nvidia rtx a3000,ram 16gb,monitor resolution 2560 x 1440,60hz,dell,over $3224
"ryzen ai 7 7th not to mention nvidia geforce rtx 4090 in addition to ram 128gb & qhd+ 16:9 display panel as well as 480hz laptop designed exclusively by gigabyte, ideal for ideal for running complex data analytics algorithms task? just under 2242 USD.",ryzen ai 7 7th,nvidia geforce rtx 4090,ram 128gb,qhd+ 16:9 display panel,480hz,gigabyte,just under 2242 USD
"Do you have any recommendations for laptops . This item is created by lenovo, including amd ryzen 9 6th with amd radeon rx 7600s & ram 24gb combined with display 2160p as well as 120hz suitable for software development and coding The maximum budget is 2808..",amd ryzen 9 6th,amd radeon rx 7600s,ram 24gb,display 2160p,120hz,lenovo,The maximum budget is 2808.
"Suggest powerful laptops . It is a asus product, with core i9 9th accompanied by nvidia geforce rtx 4090 , 16gb next to 2160p display resolution combined with 250hz suitable for running high-performance data mining software ranging from 1706 dollars to unknown dollars.",core i9 9th,nvidia geforce rtx 4090,16gb,2160p display resolution,250hz,asus,ranging from 1706 dollars to unknown dollars
"Suggest powerful laptops . It is a asus product, with amd ryzen 9 gen 4 along with nvidia rtx a500 not to mention 12gb ram ; 16:10 4k+ screen resolution as well as 60hz capable of handling advanced photo editing tasks over 3168.",amd ryzen 9 gen 4,nvidia rtx a500,12gb ram,16:10 4k+ screen resolution,60hz,asus,over 3168
"ryzen 7 pro gen 4 accompanied by radeon rx 7700s & 12gb ram , resolution wqxga joined by 120hz laptop . It is developed by lg, suitable for optimized for running advanced data modeling tools? The expenditure limit is unknown dollars..",ryzen 7 pro gen 4,radeon rx 7700s,12gb ram,resolution wqxga,120hz,lg,The expenditure limit is unknown dollars.
"ryzen ai 5 gen 4 & amd radeon rx 6800s , 16gb ram accompanied by quad hd resolution alongside 300hz laptop . It comes from acer, efficient for designed for high-speed data analysis performance? The maximum amount I can spend is 2277 dollars..",ryzen ai 5 gen 4,amd radeon rx 6800s,16gb ram,quad hd resolution,300hz,acer,The maximum amount I can spend is 2277 dollars.
"Looking for information on laptops . It is a lg product, having intel core i7 11800h not to mention nvidia rtx 3080 besides ram 96gb combined with 3840 x 2400 coupled with 250hz optimized for running advanced data modeling tools fluctuating between 1458 USD and 2018 USD.",intel core i7 11800h,nvidia rtx 3080,ram 96gb,3840 x 2400,250hz,lg,fluctuating between 1458 USD and 2018 USD
"Is there a laptop . This product belongs to microsoft, available that ryzen ai 7 gen 8 coupled with nvidia geforce gtx 1650 ti along with ram 24gb as well 3840 x 2160 resolution besides 360hz optimized for running advanced data modeling tools more or less 3129 dollars.",ryzen ai 7 gen 8,nvidia geforce gtx 1650 ti,ram 24gb,3840 x 2160 resolution,360hz,microsoft,more or less 3129 dollars
"core i7 with rtx 3070 ti and ram 128gb accompanied by 2k screen resolution alongside 250hz laptop assembled by dell, designed to govern suitable for running high-end graphics applications? Budget ceiling is set at 2712..",core i7,rtx 3070 ti,ram 128gb,2k screen resolution,250hz,dell,Budget ceiling is set at 2712.
"Have any laptops . It is manufactured by lg, available that feature ryzen 7 and nvidia rtx 2000 ada along with ram 12gb joined by screen resolution retina-like with 60hz optimized for running advanced data analytics tools and under 1648 dollars.",ryzen 7,nvidia rtx 2000 ada,ram 12gb,screen resolution retina-like,60hz,lg,and under 1648 dollars
"core ultra 7 alongside nvidia rtx a3000 plus 40gb ram and display resolution quad extended (16:10) combined with 250hz laptop developed in-house by hp, designed to enhance capable of handling large-scale data analytics? ranging from $unknown to $2282.",core ultra 7,nvidia rtx a3000,40gb ram,display resolution quad extended (16:10),250hz,hp,ranging from $unknown to $2282
"Need a laptop . An innovation from acer, with intel core i5 14450hx , rtx 4050 besides 24gb ram and 3k5 monitor resolution alongside 360hz capable of handling large-scale data mining spanning from 2193 to 1408.",intel core i5 14450hx,rtx 4050,24gb ram,3k5 monitor resolution,360hz,acer,spanning from 2193 to 1408
